user_input,retrieved_contexts,response,reference,context_recall,answer_correctness,faithfulness,answer_relevancy
Côn bố còn được gọi bằng những tên nào?,"['# **1. CÔN BỐ**\n\n* Tên khác.* **Hải côn bố, Hải đới, Nga chưởng thái.**\n\n* Tên khoa học.* **Laminaria japonica Aresch (Hải đới)**\n\n* Mô tả.* **Côn bố Laminaria japonica là loại tảo sống nhiều năm, thân dẹt, có màu nâu, có móc để bám vào đá, thân hình trụ, lá dẹt, mép có răng cưa nhỏ.**\n\n![](![id: cay-thuoc-vi-thuoc-phong-chua-benh-noi-tiet_img_012](cay-thuoc-vi-thuoc-phong-chua-benh-noi-tiet_img_012.png))\n\n* Hỉnh 8. Côn bố*\n* Tính năng công dụng và liều dùng.* **Côn bố vị mặn, tính hàn, có tác dụng nhuyễn kiên tán kết, hóa đờm tiêu tích. Do đờm khí kết tụ mà sinh tràng nhạc, hạch (bao gồm hạch limpo, sưng tuyến giáp trạng) có thể dùng côn bố phối với nguyên sâm, Sinh mẫu lệ, hạ khô thảo, bối mẫu, hoàng cầm, xích thược, hồng hoa, bách bộ, hải tảo...**\n\n* *Trong bụng do có đờm thực, huyết ứ tích lâu ngày thành cục mà sinh phỉ, tệ, mảng aíng (bao gồm sưng gan, lá lách, nang, sưng trong bụng, khối u...) có thể dùng côn bố với mai ba ba nướng, Sinh mẫu lệ, sinh hương phụ, thảo hồng hoa, cứu sơn giác, tiêu thần khúc, sơn tra hạch (hạt), đương quy, đào nhân, tam lăng, nga truật... để tiêu tán tích khối.**\n\n* *Nghiên cứu gần đây cho biết: côn bố có thể dùng vào chữa cường tuyến giáp trạng và sưng tuyến giáp trạng do thiếu iốt.**\n* *Hải tảo và côn bố có tác dụng gần giống nhau, tuy dược lực của hải tảo tương đối hòa hoãn, côn bố thì mạnh hơn mà lại hoạt lợi. Đối với loại hải tảo, côn bố, người thời xưa ăn nhiều chỉ có tác dụng giảm béo. Dùng chữa cho người béo, xơ vữa động mạch, huyết áp cao, có hiệu quả nhất định. Lượng dùng thường là 8 - 12g.**\n\n* Chú ý.* **Người tỳ vị hư hàn và hàn đờm tích tụ thì không nên dùng.**', '#### **2. THANH ĐẠI**\n\n* Tên khác.* **Điện, Điện hoa, Điện mạt, Lam điện, Điện mat hoa.**\n\n* Tên khoa học.* **Baphicacanthus cusia Bremek.**\n\n* Mô tả\\* **Thanh đại là loại cây nhỏ, cao 30-80mm, thân thắng, cành non có cạnh và lông trắng. Lá kép lông chim lẻ, mọc so le, không có cuống, phiến lá hình trứng ngược. Mùa xuân, thu nỏ hoa thành chùm ở kẽ lá, hoa màu vàng hồng. Quả giáp hình dài viên trụ, màu đen, không có lông, có 5-12 hạt.**\n\n![](![id: cay-thuoc-vi-thuoc-phong-chua-benh-noi-tiet_img_013](cay-thuoc-vi-thuoc-phong-chua-benh-noi-tiet_img_013.png))\n\n* Hình 9: Thanh đại*\n* Tính năng công dụng và liều dùng.* **Thanh đại vị mặn, tính hàn. Tác dụng thanh nhiệt mát máu, giải độc. Trị bệnh bạch huyết, ung thư tuyến tuy, bệnh sốt nóng phát ban, trẻ em kinh giản sốt nóng, viêm tuyến mang tai, khạc ra máu, mửa ra máu, chữa các bệnh về tuyến tụy.**\n\n* *Với chứng huyết nhiệt vong hành mà gây máu cam, thổ huyết, ho ra máu và ôn nhiệt nhập huyết, nhiệt độc phát ban... có thể dùng thanh đại phôi cùng với Sinh địa, nguyên sâm, đại thanh diệp, bạch mao căn, sinh thạch cao, tri mẫu, đơn bì than, chi tử than, ngẫu tiết than... Lấy bông thâm nước hoặc băng lụa sạch nhúng thanh đại, huyết hư thán (2:1) nút vào mũi có thể cầm chảy máu cam.**\n\n* *Với can hư hỏa thiên thịnh, nhiệt lực sinh phong mà gây sốt cao co giật, kinh hãi hôn mê, có thể phối dùng với đảm tính, toàn yết, thiên trúc hoàng, uất kim, hoàng liên, viễn chí, xương bồ, Câu đằng.**\n* *Với phổi nhiệt gây ho, đờm dmh thàrửì khôi khó khạc ra, có thể dùng thanh đại tiêu diệt đờm thương cách, thường phôi dùng với cáp phấn (bột tắc kè).**\n\n* *Thanh đại còn có thể dùng chữa ho, trị mụn loét cổ họng đỏ tấy đau, gồm thanh đại, nha tiêu, chu sa, mỗi thứ 1,8g, hoàng liên, hoàng bá, mỗi thứ 6-9g, băng phiến 0,3g tán bột mịn thôi vào vùng họng. Khi chữa quai bị, tuyến má sưng to đau nhức, có thể dùng thanh đại hòa với nước sôi để nguội bôi lên có thể tiêu thũng trừ thống.**\n\n* *Thanh đại diệp, thanh tâm vị độc nhiệt, thiên dùng ôn dịch nhiệt cuồng. Thanh đại tả can kinh uất hỏa, thiên dùng vào kinh hãi ban nhiệt.**\n\n* *Liều dùng thường là 0,9 - 4,5g bọc vải khi nấu (nếu cho vào thuốc sắc uống mỗi lần 0,3 - 0,6g hoặc 1kg).**\n\n* Chú ỷ. Với* **người trung tiêu hư hàn và âm hư trào nhiệt thì kị dùng.**', '#### **5. SƠN TRA**\n\n* Tên khác.* **Hồng quả tử, ương sơn hồng quả, Xích táo tử, Đường đệ tử, Đường cầu, Hải hồng, Bắc sơn tra, Nam sơn tra, Dã sơn tra, Aubepin.**\n\n* *Tên khoa học: Crataegus pinnatifida Bunge (Bắc sơn tra, Sơn lý hồng) Crataegus Cuncata sieb.et Zuce (Dã sơn tra, Nam sơn tra).**\n* Mô tả\\* **Bắc sơn tra (Sơn lý hồng, Đại sơn tra, Sơn quả tử) là cây sống nhiều năm cao 5-8m, phân nhánh nhiều.** **cành nhỏ, thường có nhiều gai. Lá mọc so le, cuống dài, phiến lá rộng, hai bên có răng cưa, mặt dưới lá dọc theo các gân có lông mịn. Mùa hạ ra hoa màu trắng hoặc hồng hợp thành tán mọc ở ngọn cây hoặc nách lá. Quả hình cầu, khi chín màu đỏ thẫm, thịt dày, vỏ có chấm vàng vị chua.**\n\n![](![id: cay-thuoc-vi-thuoc-phong-chua-benh-noi-tiet_img_016](cay-thuoc-vi-thuoc-phong-chua-benh-noi-tiet_img_016.png))\n\n* Hình 12. Sơn tra*\n\n* *Dã sơn tra là cây gỗ sống nhiều năm, cây cao 10 - 15m, chỉ khác là lá nhỏ hơn, quả cũng nhỏ hơn Bắc sơn tra, màu đỏ thâm, cây mọc ở rừng, ở Việt Nam hiện nay khai thác nhiều loại quả mang tên Sơn tra như sau:**\n\n* *- Cây Chua chát tên khoa học là Malus doumeri Bois Chey, Docyma doumeri (Bois) Scheid. Họ Hoa hồng**\n* *(Rosaceae). Chua chát là cây gỗ cao 10-12m, cây nhỏ có gai, lá hình bầu dục, mép có răng cưa. Hoa màu trắng, quả tròn hơi dẹt, khi chính có màu vàng xanh, vị chua chát. Mùa ra hoa tháng 1-2, mùa quả tháng 9-10. Cây mọc nhiều ở vùng Cao Bằng, Lạng Sơn, nhân dân khai thác bán sang Trung Quốc với tên Sơn tra.**\n\n* *- Cây táo mèo tên khoa học Docyma indica Mali. Táo mèo là cây nhỡ, cao 5-7m, cây nhỏ cành có gai, lá mọc so le, chia 3 thùy, mép có răng cưa không đều. Cây lớn lá hình bầu dục, hơi khía răng cưa, hoa màu trắng, ra hoa tháng 2-3. Quả hình thuôn, khi chín có màu vàng xanh, mùa quả tháng 9-10, quả có vị chua chát. Cây này mọc hoang và trồng ở Lào Cai, Nghĩa Lộ, Sơn La, Lai Châu.**\n\n* *Loài Docynia delavagi (Eranch) gần giống 2 cây trên, được thu hái mang tên Sơn tra.**\n\n* *Thu hái quả làm thuốc, hái về bổ ngang hay dọc, sấy hoặc phơi khô.**\n\n* Tính vị, công năng liều dùng.* **Sơn tra có vị chua, tính ôn vào 3 kinh Can, Tỳ, Vị.**\n* *Tác dụng tiêu thực tích, tán ứ, giảm đau, sát ưùng, tiêu đờm, giải độc cá. Trị lỵ, tả tích khôi, huyết khối, u bướu đường tiêu hóa, tích cá thịt, trẻ em cam tích, viêm ruột, cao huyết áp, sau đẻ đau bụng. Liều dùng 10-15g. Tây y dùng lá, quả, hoa trị bệnh tuần hoàn mạch máu, giảm đau, an thần. Nếu ăn nhiều Sơn tra thì hao khí, hại răng, do đó người suy nhược gầy ốm không nên dùng nhiều.**\n\n* *ứng dụng: Ngoài dùng chữa bệnh nội tiết và chuyển hóa, Tiêu sơn tra còn dùng trong các trường hợp.**\n\n| *Tiêu sơn tra     | 500g     | Ô mai       | 500g |\n|-------------------|----------|-------------|------|\n| Sao sơn dược      | 2000g    | Phục linh   | 250g |\n\n* *Các vị thuốc tán bột, mỗi ngày dùng 3 lần, 1 lần 6-10g với mật ong. Trị ung thư dạ dày.**\n\n| *Sơn tra (cả hột) | 15 g     | Tam thất    | 3g |\n|-------------------|----------|-------------|------|\n| Gạo tẻ            | 50g      |             |      |\n\n* *Nâu cháo, thêm mật ong dùng mỗi ngày 1 thang. Trị ung thư dạ dày, ung thư ruột.**\n\n| *Sơn tra     | 30g     | Đường đỏ       | 30g  |\n|--------------|---------|----------------|------|\n\n* *Sắc uống mỗi ngày 1 thang, chữa mỡ máu cao.**\n\n| *Hạt sơn tra      | 100 g    | Hạt cảm lãm | 100g |\n|-------------------|----------|-------------|------|\n| Kê nội kim        | 25g (sao vàng)  |             |      |\n* *Các vị tán bột, mỗi ngày uống 2-3 lần, 1 lần 5-10g với nước cơm, trị ung thư dạ dày.**\n\n* *\\* Sơn tra hạt và thịt sao cháy, dùng 1 ngày 2 - 3 lần, 1 lần 6-12g, trị ung thư ruột sinh tiêu chảy.**\n\n| *Hạt sơn tra      | 100 g    | Hạt cảm lãm | 100g |\n|-------------------|----------|-------------|------|\n| Hạt vải           | 100g     |             |      |\n\n* *Các vị sao tồn tính, tán bột. Mỗi ngày uống 2-3 lần, 1 lần 6-12g với thang Tiểu hồi hương. Trị u bướu thận và hoàn sưng to.**\n\n| *Sơn tra     | 50g    | Bán chi liên | 15g |\n|--------------|----------|-------------|------|\n| Hoàng bá     | 10g     | Ngân hoa     | 15g  |\n| Xuyên luyện tử    | 15g    | Miết giáp | 15g |\n| Tiêu nhân chướng  | 12g    | Dã cúc hoa | 10g |\n| Sơn giáp      | 10g    |    |   |\n\n* *Sắc uống mỗi ngày 1 thang trị viêm tuyến vú.**']","Côn bố còn được gọi bằng những tên sau: Hải côn bố, Hải đới, và Nga chưởng thái.","Hải đới, Nga chưởng thái (tảo biển).",1,0.656307808,1.0,0.968098373
Côn bố thuộc nhóm dược liệu nào theo mô tả?,"['# **1. CÔN BỐ**\n\n* Tên khác.* **Hải côn bố, Hải đới, Nga chưởng thái.**\n\n* Tên khoa học.* **Laminaria japonica Aresch (Hải đới)**\n\n* Mô tả.* **Côn bố Laminaria japonica là loại tảo sống nhiều năm, thân dẹt, có màu nâu, có móc để bám vào đá, thân hình trụ, lá dẹt, mép có răng cưa nhỏ.**\n\n![](![id: cay-thuoc-vi-thuoc-phong-chua-benh-noi-tiet_img_012](cay-thuoc-vi-thuoc-phong-chua-benh-noi-tiet_img_012.png))\n\n* Hỉnh 8. Côn bố*\n* Tính năng công dụng và liều dùng.* **Côn bố vị mặn, tính hàn, có tác dụng nhuyễn kiên tán kết, hóa đờm tiêu tích. Do đờm khí kết tụ mà sinh tràng nhạc, hạch (bao gồm hạch limpo, sưng tuyến giáp trạng) có thể dùng côn bố phối với nguyên sâm, Sinh mẫu lệ, hạ khô thảo, bối mẫu, hoàng cầm, xích thược, hồng hoa, bách bộ, hải tảo...**\n\n* *Trong bụng do có đờm thực, huyết ứ tích lâu ngày thành cục mà sinh phỉ, tệ, mảng aíng (bao gồm sưng gan, lá lách, nang, sưng trong bụng, khối u...) có thể dùng côn bố với mai ba ba nướng, Sinh mẫu lệ, sinh hương phụ, thảo hồng hoa, cứu sơn giác, tiêu thần khúc, sơn tra hạch (hạt), đương quy, đào nhân, tam lăng, nga truật... để tiêu tán tích khối.**\n\n* *Nghiên cứu gần đây cho biết: côn bố có thể dùng vào chữa cường tuyến giáp trạng và sưng tuyến giáp trạng do thiếu iốt.**\n* *Hải tảo và côn bố có tác dụng gần giống nhau, tuy dược lực của hải tảo tương đối hòa hoãn, côn bố thì mạnh hơn mà lại hoạt lợi. Đối với loại hải tảo, côn bố, người thời xưa ăn nhiều chỉ có tác dụng giảm béo. Dùng chữa cho người béo, xơ vữa động mạch, huyết áp cao, có hiệu quả nhất định. Lượng dùng thường là 8 - 12g.**\n\n* Chú ý.* **Người tỳ vị hư hàn và hàn đờm tích tụ thì không nên dùng.**', '# THUỐC, CÂY THUỐC, VỊ THUỐC CHỮA BỆNH NỘI TIẾT VÀ RỐI LOẠN CHUYỂN HÓA\n\n* *Nói chung đốì với các bệnh nội tiết và rối loạn chuyển hóa không có các cây thuốc hay vị thuốc đặc hiệu để điều trị. Để chữa các bệnh nội tiết và rối loạn chuyển hóa, y học cổ truyền dùng các cây thuốc và vị thuốc chữa các triệu chứng và nguyên nhân gây bệnh nội tiết và rối loạn chuyển hóa.**\n\n* *Ví dụ; Bướu cổ là do thiếu iốt thì dùng Côn bố, Hải tảo vì trong Côn bố"", Hải tảo có nhiều iốt.**\n\n* *Bướu cổ, cường tuyến giáp dẫn đến khí trệ đàm ngưng thì dùng các cây thuốc, vị thuốc có tác dụng hành khí hóa đàm như Trần bì, Mộc hương để hành khí, Bạch giới tử để hóa đàm.**\n\n* *Bệnh cương giáp là do can khí uất trệ thì phải thanh can tả hỏa bằng Mộc hương, Long đởm thảo, Thiên hoa phấn.**\n* *Bệnh đái tháo đường là do nhiệt ở tam tiêu nên phải dùng các cây thuốc, vị thuốc tharửi nhiệt, sinh tân như Sinh địa, Hoài sơn, Huyền sâm, Phục linh...**\n\n* *Vì vậy những cây thuốc, vị thuốc dùng để chữa bệnh nội tiết và rối loạn chuyển hóa cũng thường được dùng để chữa một số chứng bệnh khác trên cơ sở công năng và tác dụng của nó.**\n\n* *Để sử dụng các cây thuốc, vị thuốc thường dùng trong các bài thuốc chữa bệnh nội tiết và rối loạn chuyển hóa, trong phần líng dụng của từng cây thuốc, vị thuốc có giới thiệu thêm việc ứng dụng để điều trị một số bệnh khác để tham khảo và vận dụng.**', '#### **Các bài thuốc kinh nghiệm dân gian:**\n\n- **\\* Hải đới 250g. Rửa sạch, dùng lửa nhỏ nấu đặc thành cao, bỏ xác, uống ngày 1 thang.**\n- **\\* Hải tảo 500g, Hải đới 500g rửa sạch sấy khô tán bột mịn. Mỗi ngày uống 10g với nước sôi nguội. Hải tảo**\n\n* *không được dùng chung với Cam thảo.**\n- **\\* Côn bố 30g, Toàn yết (Bò cạp) 1 con. Côn bố sắc bỏ xác, Toàn yết, nung cháy tán bột. Nước sắc thuốc uống với bột Bò cạp mỗi sáng 1 lần, liên tục 10 ngày.**\n- **\\* Côn bố 15g, Hải tảo 15g, Mẫu lệ 15g. sắc uống, ngày 1 thang liên tục trong nhiều ngày. Dùng lốt cho thể can khí uất.**\n- **\\* Sài hồ 9g, Phật thủ 9g, Uất kim 15g, Hải tảo 15g. sắc bỏ xác, cho gạo nấu cháo thêm đường mía uống, ngày 1 thang, liên tục trong 10-15 ngày.**\n- **\\* Hạ khô thảo 100g, Sa sâm 30g, Mạch môn 30g, Sinh địa 30g, Huyền sâm 30g, Hải tảo 50g. sắc 2 lần được 500ml, cho đường trắng nấu cao. Mỗi lần uống 20ml, ngày 3 lần.**\n- **\\* Xuyên bối 15g, Côn bố 15g, Đơn sâm 15g, Ý dĩ 30g, Đông qua 60g, Đường đỏ vừa đủ. Hai vị sắc nước, bỏ bã, các vị sau cho vào nấu cháo ăn, ngày 1 thang, liên tục uống 15-20 thang. Dùng cho thể đàm thấp kết tụ.**\n- **\\* Hải tảo 15g, Hải đới 15g, Thịt hàu (mẫu lệ nhục) 60g. Hai vị đầu rửa sạch cát cho thịt hàu vào nấu chín ăn thịt uống nước. Dùng tốt cho bệnh nhân trẻ tuổi mắc bệnh thể cường giáp thiếu iốt.**\n- **\\* Đậu xanh 60g, Hải đới 30g, Gạo 30g, Trần bì 6g, Đường đỏ 60g. sắc chính đậu xanh nở mềm là ăn được.**\n- **\\* Hạ khô thảo 20g, Mẫu lệ 15g, Hải tảo 10g, Côn bố 10g. Sắc uống kèm theo uống Bổ Tâm đơn.**\n| *Hoàng kỳ  | 30g  | Hạ khô thảo  | 30g |\n|-------------|------|--------------|-----|\n| Đảng sâm    | 20g  | Miết giáp    | 15g |\n| Quy bản     | 12g  | Thủ ô        | 12g |\n| Sinh địa    | 12g  | Bạch thược   | 12g |\n| Hoài sơn    | 12   | Hương phụ    | 12g |\n\n* *Sắc uống. Dùng cho bệnh nhân kèm tuyến giáp to**\n\n| * Đương quy | 10g  | Chi tử     | 10g  |\n|--------------|------|-------------|------|\n| Bạch truật   | 10g  | M ãnkinh tử | 10g  |\n| U ấtkừn      | 10g  | Sài hồ     | 12g |\n| Đơn sâm      | 12g | Bạch thược  | 12g  |\n| Hoàng cầm   | 12g | Lá Bạc hà   | 6g   |\n| Cam thảo     | ^8   |             |      |\n\n* *sắc uống ngày 1 thang, 10 ngày là một liệu trình.**\n\n| *Đương quy    | 10g | Sinh hoàng kỳ | 30g |\n|---------------|-----|---------------|-----|\n| Sinh thục địa | 10g | Hoàng bá      | 10g |\n| Hoàng cầm     | 10g | Ngũ vị tử     | 10g |\n| Đơn bì        | 10g | Sinh mẫu lệ   | 10g |\n| Bạch đầu ông  | 30g | Hạ khô thảo   | 15g |\n\n* *Sắc uống. Dùng cho bệnh nhân hồi hộp, mệt mỏi, ăn uống nhiều, tuyến giáp to.**\n\n| *Đương quy   | 10g  | Sinh hoàng kỳ | 30g |\n|---------------|-----|---------------|-----|\n| Sinh thục địa | 10g | Hoàng bá      | 10g |\n| Hoàng cầm     | 10g | Ngũ vị tử     | 10g |\n| Đơn bì        | 10g | Sinh mẫu lệ   | 30g |\n| Bạch đầu ông  | 30g | Hạ khô thảo   | 15g |\n\n* *Sắc uống. Dùng cho bệnh nhân hồi hộp, mệt mỏi, ăn uống nhiều, tuyến giáp to.**\n\n| *Đương quy    | 30g | Mạch đông   | 30g |\n|---------------|-----|-------------|-----|\n| Ngũ vị        | 30g | Đảng sâm    | 30g |\n| Tam lăng      | 30g | Côn bố      | 30g |\n| Hải tảo       | 30g | Nga truật   | 30g |\n| Ngọc trúc     | 30g | Ô mai       | 30g |\n| Sinh thục địa | 30g | Hoàng cầm   | 30g |\n| Hoàng liên    | 30g | Hoàng bá    | 30g |\n| Bạch đầu ông  | 60g | Sinh Mẫu lệ | 50g |\n| Lệ chi hạch   | 50g | Quất hạch   | 50g |\n| Sinh hoàng kỳ | 90g | Hạ khô thảo | 90g |\n|               |     |             |     |\n* *Tất cả tán bột mịn, hoàn mật, mỗi hoàn 10g. Mỗi lần uống 1 hoàn.**\n\n| * Sinh hoàng kỳ     | 20g | Đương quy   | 10g |\n|---------------------|-----|-------------|-----|\n| Sinh thục địa       | 10g | Hoàng cầm   | 10g |\n| Hoàng liên          | 3g  | Hoàng bá    | 10g |\n| Quất hạch           | 10g | Lệ chi hạch | 10g |\n| Hạ khô thảo         | 20g | Mẫu lệ      | 30g |\n| Bạch đầu ông        | 30g |             |     |\n* *Sắc uống.**           \n| *Đảng sâm          | 30g | Chỉ xác     | 30g |\n| Ô mai              | 30g | Côn bố      | 30g |\n| Mạch môn           | 30g | Ngũ vị tử   | 30g |\n| Quất hạch          | 30g | Lệ chi hạch | 30g |\n| Hải tảo            | 30g | Hạ khô tháo | 30g |\n| Đơn sâm            | 90g | Quy bản     | 60g |\n| Bạch đầu ông       | 60g |             |     |\n|                     |     |             |     |\n\n* *Tất cả tán bột làm hoán nặng 10g. Uống sáng, trưa, tối mỗi lần 1 hoàn.**']",根据描述，海带（Côn bố）属于海藻类药物。海带是一种多年生的扁形藻类，具有软骨质的附着器，用于固定在石头上，其形态为圆柱状，叶片薄且边缘有细齿。因此，海带被归类为海藻类药物。,Một loại tảo biển.,1,0.145308747,0.6,0.693377302
Những người có thể trạng nào thường kỵ dùng Côn bố?,"['# **1. CÔN BỐ**\n\n* Tên khác.* **Hải côn bố, Hải đới, Nga chưởng thái.**\n\n* Tên khoa học.* **Laminaria japonica Aresch (Hải đới)**\n\n* Mô tả.* **Côn bố Laminaria japonica là loại tảo sống nhiều năm, thân dẹt, có màu nâu, có móc để bám vào đá, thân hình trụ, lá dẹt, mép có răng cưa nhỏ.**\n\n![](![id: cay-thuoc-vi-thuoc-phong-chua-benh-noi-tiet_img_012](cay-thuoc-vi-thuoc-phong-chua-benh-noi-tiet_img_012.png))\n\n* Hỉnh 8. Côn bố*\n* Tính năng công dụng và liều dùng.* **Côn bố vị mặn, tính hàn, có tác dụng nhuyễn kiên tán kết, hóa đờm tiêu tích. Do đờm khí kết tụ mà sinh tràng nhạc, hạch (bao gồm hạch limpo, sưng tuyến giáp trạng) có thể dùng côn bố phối với nguyên sâm, Sinh mẫu lệ, hạ khô thảo, bối mẫu, hoàng cầm, xích thược, hồng hoa, bách bộ, hải tảo...**\n\n* *Trong bụng do có đờm thực, huyết ứ tích lâu ngày thành cục mà sinh phỉ, tệ, mảng aíng (bao gồm sưng gan, lá lách, nang, sưng trong bụng, khối u...) có thể dùng côn bố với mai ba ba nướng, Sinh mẫu lệ, sinh hương phụ, thảo hồng hoa, cứu sơn giác, tiêu thần khúc, sơn tra hạch (hạt), đương quy, đào nhân, tam lăng, nga truật... để tiêu tán tích khối.**\n\n* *Nghiên cứu gần đây cho biết: côn bố có thể dùng vào chữa cường tuyến giáp trạng và sưng tuyến giáp trạng do thiếu iốt.**\n* *Hải tảo và côn bố có tác dụng gần giống nhau, tuy dược lực của hải tảo tương đối hòa hoãn, côn bố thì mạnh hơn mà lại hoạt lợi. Đối với loại hải tảo, côn bố, người thời xưa ăn nhiều chỉ có tác dụng giảm béo. Dùng chữa cho người béo, xơ vữa động mạch, huyết áp cao, có hiệu quả nhất định. Lượng dùng thường là 8 - 12g.**\n\n* Chú ý.* **Người tỳ vị hư hàn và hàn đờm tích tụ thì không nên dùng.**', '## Page 191\n\n- Băng ép chi phía trên chỗ tiêm hoặc đường vào của nọc độc.\n\nVII. DỰ PHÒNG\n\nCần chú ý phòng sốc phản vệ bằng cách\n\n-  Hỏi kỹ tiền sử dị ứng\n\n-  Tránh tiếp xúc các yếu tố nguy cơ ở các bệnh nhân có tiền sử dị ứng\n\n-  Chuẳn bị sẵn sàng hộp chống sốc.\n\n55.\nHÔN MÊ DO SUY GIÁP TRẠNG\n\nHôn mê giáp: biến chứng hiếm gặp trong suy giáp\n\n-  Hay xảy ra ở nữ hơn nam. Khoảng 50% ở tuổi 60-70\n\n-  Suy giáp trạng nguyên phát chiếm khoảng 95%\n\n- Các triệu chứng suy giáp rất âm ỉ nên BN có thể không biết bệnh trước đó, chỉ\nkhi hôn mê mới được đưa vào viện.\n\n - Yếu tố thuận lợi thường gặp nhất: nhiễm trùng, nhất là nhiễm trùng hô hấp, suy\ntim.\n\n - Ngoài ra: thiếu oxy, ứ đọng CO2, hạ glucose huyết, hạ Na máu, xuất huyết,\nTBMN, chấn thương...\n\n - Khí hậu quá lạnh về mùa đông\n\n - Propranolol ngăn sự chuyển T4 thành T3 ở ngoại vi\n\n - Iod liều cao ngăn sự phóng thích hormon tuyến giáp ra khỏi tuyến\n\n - BN suy giáp nặng bỏ không dùng hormon tuyến giáp.\n\n\n\n</break>', '#### **Triệu chứng lâm sàng:**\n\n* *Triệu chứng chủ yếu là to tuyến giáp.**\n\n* *Thể tán phát gặp nhiều ở nữ ở tuổi dậy thì, có thai, cho bú, lúc tắt kinh thường to hơn và qua những kỳ kinh đó tuyến lại nhỏ hơn. Thường tuyến giáp to nhẹ tản mạn, chất mềm và trơn láng. Đến tuổi trung niên về sau, bướu có thể cứng và có nổi cục.**\n\n* *Bướu cổ địa phương tính to nhỏ không chừng (rất nhỏ hoặc rất to). Theo độ to nhổ có thể chia:**\n- **+ Độ 1: Nhìn kỹ có khi phải nhìn nghiêng mới phát hiện hoặc phải sờ nắn.**\n  - **+ Độ 2: Nhìn thẳng đã thấy to.**\n  - **+ Độ 3: Bướu quá to.**\n\n* *Đôi khi bướu ở** *vị* **trí đặc biệt hoặc** *bị* **chèn ép khó** *chẩn đoán.***\n\n* *Bướu giáp chìm: Bướu** *ở cổ* **nhưng trong lồng ngực sau xương ức. Bướu làm khó chịu mỗi khi nuốt và thở. Bướu trong lồng ngưc, X quang thấy như một u trung thất.**\n\n* *Bướu dưới lưỡi: Gặp ở phụ nữ, ở đáy lưỡi làm cho khó nhai, khó nuốt và khó nói.**\n\n* *Bướu cổ mới bắt đầu nhỏ mặt bóng nhẵn, về sau có thể to nhỏ không chừng, cứng thành cục hoặc nang, bề mặt có thể có tĩnh mạch nổi còng quèo. Trường hợp quá to sẽ có hiện tượng chèn ép như: nếu chèn ép khí quản sinh ho, khó thở, vướng cổ, chèn ép thực quản thì nuốt khó, chèn hầu họng thì khàn giọng... Có khi xuất huyết trong nang gây đau và bướu to đột ngột.**\n* *Y học cổ truyền cho rằng bệnh này chủ yếu là do khí u tán kết, thủy thổ mất thích nghi, ăn uống không điều độ, ảnh hưởng đến chức năng vận hóa của tỳ vị, khiến cho cơ khí không thông, tụ lại thành đàm, khí trệ đàm ngưng, ngăn kết trước cổ hình thành bệnh anh (bướu cổ). Bệnh lâu ngày - từ khí tới huyết - huyết lưu thông ứ trệ dẫn tới đàm khí ứ kết với nhau. Bướu to chèn ép khí quản gây ra khó thở, ho khan...**\n\n* Chứng trạng* **Khí uất đàm kết, một bên hoặc hai bên phần cổ sưng to lan tỏa, hơi trướng, sắc da bình thường, mép biên không rõ, ấn mềm không đau, tùy theo tình hình vui hay cáu giận mà nhỏ hay to lên. Giữa cổ sưng to lan tỏa, trường hợp nặng như túi bọc, thống xuống tới ngực, giữa có thể sờ thấy các kết đốt to nhỏ không bằng nhau, ho ngực bí, ngột ngạt thiếu khí. Lưỡi đỏ rêu trắng, mạch huyền.**\n\n* Pháp điều trị:* **Thư can lý khí, hóa đàm tiêu anh.**\n\n* Bài thuốc:* **Tứ hải thư uất hoàn (Dương y đại hoàn) gia giảm.**\n| Thanh mộc hương 6g |     | Trần bì             | 10g |\n|----------------------|-----|---------------------|-----|\n| Côn bố              | 10g | Hải tảo            | 10g |\n| Hải cáp phấn        | 15g | Hải phiêu tiêu    | 30g |\n| Long đởm thảo        | 6g  | Hoàng dược tửu  | 10g    |\n| Hải đới           | 10g | Cát cánh            | 6g  |\n| Bạch giới tử       | 10g |                     |     |\n\n* *Các bài thuốc kinh nghiệm:**\n\n- **1. Hải đới 100g, sắc uống mỗi ngày ăn luôn xác.**\n- **2. Hải tảo, Côn bố lượng bằng nhau tán bột mịn luyện mật làm hoàn, mỗi lần uống 10-20g ngậm nuốt, sau bữa cơm tối. Có thể dùng lâu dài.**\n- **3. Hải tảo, Côn bố lượng bằng nhau, Thanh bì lượng 1/3 của Côn bố, sao vàng tán bột làm hoàn. Mỗi ngày uống 10g sau bữa ăn tối. Uống lâu dài.**\n- **4. Uất kim, Đan sâm, Hải tảo đều 15g. Sắc uống ngày 1 thang, có thể cho đường uống thường xuyên, liên tục trong 3 - 4 tuần. Dùng cho thể khí huyết ứ trệ.**\n- **5. Hải đới 60g, Đậu xanh 150g. Nấu chín, cho thêm đường, ăn hàng ngày.**\n- **6. Côn bố, Hải tảo, Đậu nành (đậu tương) 150 - 200g. Nấu chính gia đường để ăn thường xuyên.**\n  - **7. Hạ khô thảo 30g, Hải tảo 60g sắc uống hàng ngày.**\n  - **8. Triết bối mẫu, Hải tảo, Mẫu lệ đều 12g, tán bột mịn**\n* *trộn đều. Mỗi lần uống 6g, ngày 2 lần, uống trước khi ăn với rượu trắng.**\n\n- **9. Bạch thược 15g, Huyền sâm 9g, Hạ khô thảo 30g, Hải phù thạch 30g, Chế hương phụ 12g, Bạch giới tử 12g, Gia cương tằm 12g, Trạch tả 15g, Thất diệp nhất chi hoa 20g. Sắc uống hàng ngày.**\n- **10. Mẫu lệ, Hải tảo, Côn bố, Bạch tật lê, Bạch thược, Sinh địa, Huyền sâm, Kỷ tử, Sung úy tử lượng bằng nhau. Tất cả tán bột mịn cho mật làm hoàn 10g. Mỗi ngày uống 2-3 lần với nước sôi nguội.**\n- **11. Hà thủ ô 20g, Ô mai 10g, Côn bố 15g. Sắc uống hàng ngày.**\n- **12. Lá sinh địa (Sinh địa diệp), Hạ khô thảo 30g, Sơn tra 20g, sắc uống hàng ngày.**']","The context information indicates that people with a weak and cold stomach constitution should avoid using Côn bố. Specifically, it states: ""Người tỳ vị hư hàn và hàn đờm tích tụ thì không nên dùng."" This translates to: ""People with a weak and cold stomach constitution and those with accumulated cold phlegm should not use Côn bố.""",Người tỳ vị hư hàn.,1,0.651462465,1.0,0.778511064
Côn bố kỵ dùng khi có tình trạng bệnh lý nào liên quan đàm?,"['# **1. CÔN BỐ**\n\n* Tên khác.* **Hải côn bố, Hải đới, Nga chưởng thái.**\n\n* Tên khoa học.* **Laminaria japonica Aresch (Hải đới)**\n\n* Mô tả.* **Côn bố Laminaria japonica là loại tảo sống nhiều năm, thân dẹt, có màu nâu, có móc để bám vào đá, thân hình trụ, lá dẹt, mép có răng cưa nhỏ.**\n\n![](![id: cay-thuoc-vi-thuoc-phong-chua-benh-noi-tiet_img_012](cay-thuoc-vi-thuoc-phong-chua-benh-noi-tiet_img_012.png))\n\n* Hỉnh 8. Côn bố*\n* Tính năng công dụng và liều dùng.* **Côn bố vị mặn, tính hàn, có tác dụng nhuyễn kiên tán kết, hóa đờm tiêu tích. Do đờm khí kết tụ mà sinh tràng nhạc, hạch (bao gồm hạch limpo, sưng tuyến giáp trạng) có thể dùng côn bố phối với nguyên sâm, Sinh mẫu lệ, hạ khô thảo, bối mẫu, hoàng cầm, xích thược, hồng hoa, bách bộ, hải tảo...**\n\n* *Trong bụng do có đờm thực, huyết ứ tích lâu ngày thành cục mà sinh phỉ, tệ, mảng aíng (bao gồm sưng gan, lá lách, nang, sưng trong bụng, khối u...) có thể dùng côn bố với mai ba ba nướng, Sinh mẫu lệ, sinh hương phụ, thảo hồng hoa, cứu sơn giác, tiêu thần khúc, sơn tra hạch (hạt), đương quy, đào nhân, tam lăng, nga truật... để tiêu tán tích khối.**\n\n* *Nghiên cứu gần đây cho biết: côn bố có thể dùng vào chữa cường tuyến giáp trạng và sưng tuyến giáp trạng do thiếu iốt.**\n* *Hải tảo và côn bố có tác dụng gần giống nhau, tuy dược lực của hải tảo tương đối hòa hoãn, côn bố thì mạnh hơn mà lại hoạt lợi. Đối với loại hải tảo, côn bố, người thời xưa ăn nhiều chỉ có tác dụng giảm béo. Dùng chữa cho người béo, xơ vữa động mạch, huyết áp cao, có hiệu quả nhất định. Lượng dùng thường là 8 - 12g.**\n\n* Chú ý.* **Người tỳ vị hư hàn và hàn đờm tích tụ thì không nên dùng.**', '#### *4. Thể đàm thấp ngưng kết:*\n\n* *Tuyến giáp to, ngực đầy tức không muốn ăn, nôn, buồn nôn, đại tiện lỏng, lưỡi bệu rêu dày nhớt, mạch nhu hoạt.**\n\n* Phép trị:* **Hóa đàm lợi thấp, nhuyễn kiên tán kết.**\n\n* Bài thuốc:* **Hải tảo ngọc hồ thang gia giảm**\n\n| Hải tảo     | 40g  | Hải đới       | 40g |\n|-------------|------|---------------|-----|\n| Bán hạ      | 12g  | Triết bối mẫu | 12g |\n| Trạch tả    | 12g  | Phục linh     | 2g  |\n| Đương quy   | 12g  | Thanh bì      | 10g |\n| Xuyên khung | 6g   |               |     |\n* *Sắc uống ngày 1 thang, chia 3 lần.**\n\n* *Trường hợp ngực tức, sườn đau gia Xuyên luyện tử, Diên hồ sách để sơ can chỉ thống. Nếu buồn nôn, tiểu lỏng, mệt mỏi gia Bạch truật, Ý dĩ, Biển đậu để kiện tỳ trừ thấp.**\n\n* *Trên đây là cách phân thể bệnh theo triệu chứng nổi bật: bệnh thuộc thể khí trệ, hỏa thịnh, âm hư hay đàm thấp ngưng kết, nhưng trên lâm sáng bệnh thường là đàm** **hỏa hư thực thác tạp nên có thể phân theo thể nhẹ, nặng, chứng nguy và biện chứng để trị như sau:**\n* 1. Chứng nhẹ:* **biểu hiện chủ yếu là thể can khí uất kết đàm sinh hỏa nhiễu tâm nên phép trị chủ yếu là sơ can nhiệt thanh tâm hóa đàm tán kết, bài thuốc dùng Đơn chi tiêu dao tán hợp Toan táo nhân thang gia giảm (sao):**\n\n| Sơn chi      | 8g   | Tri mẫu       | 2g  |\n|--------------|----- |---------------|-----|\n| Liên tử      | 12g  | Đơn bì        | 2g  |\n| N gân sài hồ | 12g  | Triết bối mẫu | 10g |\n| Hải tảo      | 12g  | Mẫu lệ        | 10g |\n\n* *Sắc uống ngày 1 thang.**\n\n* 2. Chứng nặng:* **Biểu hiện chủ yếu là khí uất đàm kết, táo hỏa thương âm, phép trị chủ yếu là thương âm tả hỏa, hóa đàm tán kết, dùng bài thuốc có các vị:**\n| Hạ khô thảo    | 12g | Tri mẫu     | 2g  |\n|----------------|-----|-------------|---- |\n| Cúc hoa        | 8g  | Huyền sâm   | 2g  |\n| Thiên hoa phấn | 8g  | Côn bố      | 12g |\n| Trúc như       | 10g | Bối mẫu    | 8g  |\n| Sinh long cốt  | 10g | Sinh mẫu lệ | 12g |\n| Sinh đại hoàng | 12g |             |     |\n\n* *Sắc uống trong 2 - 3 tháng, mỗi ngày 1 thang.**\n\n- *3. Chứng nguy:* **Biểu hiện chủ yếu là táo hỏa cực thịnh làm suy kiệt khí âm cần truyền dịch hồi sức cấp cứu theo tây y, khí âm được hồi phục, chuyển sang điều trị như đối với thể nặng có kết hợp thuốc tân dược.**\n- *4. Biến chứng:* **(1) Đau ngực (hung tý): do can khí uất trệ, nhiệt đàm làm tắt kinh lạc. Phép trị là sơ can thông lạc thanh nhiệt hóa đàm dùng các vị:**\n\n| Khương bán hạ     | 8g | Qua lâu bì | 12g |\n|-------------------|----|------------|-----|\n| Chỉ thực          | 8g | Uất kim    | 12g |\n| Hồng hoa          | 8g | Đơn sâm    | 12g |\n| Đăng tâm          | 8g |            |     |\n\n* *Hết đau (hung tý được tuyến thông) tiếp tục phép trị chứng nặng gia thuốc hoạt huyết hóa ứ.**\n\n* *(2) Chân tay yếu mềm: Triệu chứng của can thịnh tỳ hư, khí thoát đàm kết, phép trị dùng can** *trợ* **tỳ hóa đàm tán kết, dùng các vị.**\n\n| Đơn bì         | 10g | Chi tử           | 10g |\n|----------------|-----|------------------|-----|\n| Thái tử sâm    | 12g | Bạch truật sống  | 12g |\n| Chích hoàng kỳ | 16g | Khương hán hạ    | 8g  |\n| Trần bì        | 8g  | Xuyên ngưu tát   | 12g |\n| Tàm sa         | 18g | Côn bố           | 12g |\n* *Có kết quả rồi tiếp tục dùng phép trị chứng nhẹ.**\n\n* *Thời gian điều trị bằng đông y có kết quả phải từ 1 đến 2 năm. Cần chú ý theo dõi bệnh nhân trong quá trình điều trị nếu không kết quả phải dùng thuốc kháng giáp kết hợp.**', '#### *Thể đàm thấp:*\n\n- *Chứng trạng:* **Sau khi kết hôn không có con, người béo trệ không có lực, sắc mặt trắng bệch, đầu váng, tim hồi hộp, buồn nôn, liệt dương, xuất tinh sớm, số lượng tinh trùng ít, hoạt động yếu, chất lưỡi đỏ nhạt, rêu trắng nhớt.**\n  - *Pháp điều trị:* **Kiện tỳ hòa vị, táo thấp hóa đàm.**']","Côn bố kỵ dùng khi có tình trạng bệnh lý liên quan đàm, cụ thể là khi người bệnh có tỳ vị hư hàn và hàn đờm tích tụ.",Hàn đàm tích tụ.,1,0.559254424,0.5,0.0
Hải tảo thường được dùng chữa bướu cổ do thiếu chất gì?,"['#### **Triệu chứng lâm sàng:**\n\n* *Triệu chứng chủ yếu là to tuyến giáp.**\n\n* *Thể tán phát gặp nhiều ở nữ ở tuổi dậy thì, có thai, cho bú, lúc tắt kinh thường to hơn và qua những kỳ kinh đó tuyến lại nhỏ hơn. Thường tuyến giáp to nhẹ tản mạn, chất mềm và trơn láng. Đến tuổi trung niên về sau, bướu có thể cứng và có nổi cục.**\n\n* *Bướu cổ địa phương tính to nhỏ không chừng (rất nhỏ hoặc rất to). Theo độ to nhổ có thể chia:**\n- **+ Độ 1: Nhìn kỹ có khi phải nhìn nghiêng mới phát hiện hoặc phải sờ nắn.**\n  - **+ Độ 2: Nhìn thẳng đã thấy to.**\n  - **+ Độ 3: Bướu quá to.**\n\n* *Đôi khi bướu ở** *vị* **trí đặc biệt hoặc** *bị* **chèn ép khó** *chẩn đoán.***\n\n* *Bướu giáp chìm: Bướu** *ở cổ* **nhưng trong lồng ngực sau xương ức. Bướu làm khó chịu mỗi khi nuốt và thở. Bướu trong lồng ngưc, X quang thấy như một u trung thất.**\n\n* *Bướu dưới lưỡi: Gặp ở phụ nữ, ở đáy lưỡi làm cho khó nhai, khó nuốt và khó nói.**\n\n* *Bướu cổ mới bắt đầu nhỏ mặt bóng nhẵn, về sau có thể to nhỏ không chừng, cứng thành cục hoặc nang, bề mặt có thể có tĩnh mạch nổi còng quèo. Trường hợp quá to sẽ có hiện tượng chèn ép như: nếu chèn ép khí quản sinh ho, khó thở, vướng cổ, chèn ép thực quản thì nuốt khó, chèn hầu họng thì khàn giọng... Có khi xuất huyết trong nang gây đau và bướu to đột ngột.**\n* *Y học cổ truyền cho rằng bệnh này chủ yếu là do khí u tán kết, thủy thổ mất thích nghi, ăn uống không điều độ, ảnh hưởng đến chức năng vận hóa của tỳ vị, khiến cho cơ khí không thông, tụ lại thành đàm, khí trệ đàm ngưng, ngăn kết trước cổ hình thành bệnh anh (bướu cổ). Bệnh lâu ngày - từ khí tới huyết - huyết lưu thông ứ trệ dẫn tới đàm khí ứ kết với nhau. Bướu to chèn ép khí quản gây ra khó thở, ho khan...**\n\n* Chứng trạng* **Khí uất đàm kết, một bên hoặc hai bên phần cổ sưng to lan tỏa, hơi trướng, sắc da bình thường, mép biên không rõ, ấn mềm không đau, tùy theo tình hình vui hay cáu giận mà nhỏ hay to lên. Giữa cổ sưng to lan tỏa, trường hợp nặng như túi bọc, thống xuống tới ngực, giữa có thể sờ thấy các kết đốt to nhỏ không bằng nhau, ho ngực bí, ngột ngạt thiếu khí. Lưỡi đỏ rêu trắng, mạch huyền.**\n\n* Pháp điều trị:* **Thư can lý khí, hóa đàm tiêu anh.**\n\n* Bài thuốc:* **Tứ hải thư uất hoàn (Dương y đại hoàn) gia giảm.**\n| Thanh mộc hương 6g |     | Trần bì             | 10g |\n|----------------------|-----|---------------------|-----|\n| Côn bố              | 10g | Hải tảo            | 10g |\n| Hải cáp phấn        | 15g | Hải phiêu tiêu    | 30g |\n| Long đởm thảo        | 6g  | Hoàng dược tửu  | 10g    |\n| Hải đới           | 10g | Cát cánh            | 6g  |\n| Bạch giới tử       | 10g |                     |     |\n\n* *Các bài thuốc kinh nghiệm:**\n\n- **1. Hải đới 100g, sắc uống mỗi ngày ăn luôn xác.**\n- **2. Hải tảo, Côn bố lượng bằng nhau tán bột mịn luyện mật làm hoàn, mỗi lần uống 10-20g ngậm nuốt, sau bữa cơm tối. Có thể dùng lâu dài.**\n- **3. Hải tảo, Côn bố lượng bằng nhau, Thanh bì lượng 1/3 của Côn bố, sao vàng tán bột làm hoàn. Mỗi ngày uống 10g sau bữa ăn tối. Uống lâu dài.**\n- **4. Uất kim, Đan sâm, Hải tảo đều 15g. Sắc uống ngày 1 thang, có thể cho đường uống thường xuyên, liên tục trong 3 - 4 tuần. Dùng cho thể khí huyết ứ trệ.**\n- **5. Hải đới 60g, Đậu xanh 150g. Nấu chín, cho thêm đường, ăn hàng ngày.**\n- **6. Côn bố, Hải tảo, Đậu nành (đậu tương) 150 - 200g. Nấu chính gia đường để ăn thường xuyên.**\n  - **7. Hạ khô thảo 30g, Hải tảo 60g sắc uống hàng ngày.**\n  - **8. Triết bối mẫu, Hải tảo, Mẫu lệ đều 12g, tán bột mịn**\n* *trộn đều. Mỗi lần uống 6g, ngày 2 lần, uống trước khi ăn với rượu trắng.**\n\n- **9. Bạch thược 15g, Huyền sâm 9g, Hạ khô thảo 30g, Hải phù thạch 30g, Chế hương phụ 12g, Bạch giới tử 12g, Gia cương tằm 12g, Trạch tả 15g, Thất diệp nhất chi hoa 20g. Sắc uống hàng ngày.**\n- **10. Mẫu lệ, Hải tảo, Côn bố, Bạch tật lê, Bạch thược, Sinh địa, Huyền sâm, Kỷ tử, Sung úy tử lượng bằng nhau. Tất cả tán bột mịn cho mật làm hoàn 10g. Mỗi ngày uống 2-3 lần với nước sôi nguội.**\n- **11. Hà thủ ô 20g, Ô mai 10g, Côn bố 15g. Sắc uống hàng ngày.**\n- **12. Lá sinh địa (Sinh địa diệp), Hạ khô thảo 30g, Sơn tra 20g, sắc uống hàng ngày.**', '# **4. HẢI TẢO**\n\n* Tên khác.* **Hải la, Hải đới hoa, Hải cao tử, Dương thể tháỉ.** *Tên khoa học.* **Sargassum pallidum (Tum).**\n\n* Mô tả:* **Hải tảo là cây sống nhiều năm cao 15-70mm, sợi phân nhánh giống như thân cây, màu nâu. Có những bộ phận mỏng, dẹt giống như lá, có răng cưa thô, trên mặt có những chấm đen. Tảo có những cái phao trông như quả giúp tảo đứng thắng trong nước biên.**\n* *Hải tảo mọc hoang ở vùng biển, nhiều nơi trong nước, dùng toàn cây làm thuốc.**\n\n* Tính vị, công năng liều dùng.* **Hải tảo có vị đắng, mặn, tính hàn, vào 3 kinh Can, Vị, Thận. Tác dụng làm mềm chất cứng (nhuyễn kiên) tiêu đàm, lợi thủy, trừ nhiệt. Trị** **ung thư tuyến giáp trạng, viêm phế quản mãn tính, bệnh mạch vành tìm, tích tụ, lao hạch lâm ba, thủy thũng, cước khí, sưng cao hoàn.**\n\n* *Liều dùng: 5 - 10g.**\n\n![](![id: cay-thuoc-vi-thuoc-phong-chua-benh-noi-tiet_img_015](cay-thuoc-vi-thuoc-phong-chua-benh-noi-tiet_img_015.png))\n\n* Hình 11. Hải tảo*\n\n* Ứng dụng:* **Ngoài dùng chữa bệnh nội tiết và chuyển hóa Hải tảo còn dùng trong các trường hợp.**\n\n| Hải tảo  | 30g | Bạch cương tàm | 30g |\n|----------|-----|----------------|-----|\n\n* *Các vị tán bột dùng Bạch mai làm viên, uống mỗi ngày 2-3 lần, mỗi lần 5-10g với nước cơm. Trị u hạch lâm ba.**\n\n| Hải tảo  | 15g | Thủy diệt      | 5g |\n|----------|-----|----------------|-----|\n**Hai vị tán bột uống với rượu, mỗi lần 5g, 1 ngày 2-3 lần. Trị ung thư thực quản.**\n\n| Hải tảo  | 15g | Côn bố         | 30g |\n|----------|-----|----------------|-----|\n| Thổ phục linh  | 30g |          |     |\n\n**Sắc uống với Tiểu kim phiến mỗi ngày 2 - 5-10g. Trị ung thư tuyến giáp, tuyến mang tai. 3 lần, 1 lần** \n| Hải tảo  | 15g | Hạ khô thảo        | 15g |\n|----------|-----|--------------------|-----|\n| Côn bố  | 15g  | Thổ phục linh      | 15g    |\n| Thạch vĩ  | 15g  |                  |     |\n\n**Sắc uống mỗi ngày 1 thang, trị u bướu ở khoang mắt.** \n| Hải tảo  | 30g | Hải đới        | 30g |\n|----------|-----|--------------------|-----|\n| Quyết minh tử  | 30g  | Nữ trinh tử      | 15g    |\n| Phục linh   | 20g     | Câu kỷ           | 10g    |\n| Thạch hộc   | 10g     | Thái tử sâm           | 10g    |\n\n**Sắc uống mỗi ngày 1 thang, trị ung thư tuyến vú.** \n| Hải tảo  | 20g | Côn bố        | 20g |\n|----------|-----|--------------------|-----|\n| Đương quy  | 20g  | Tục đoạn      | 20g    |\n| Bán chi liên   | 20g     | Bạch hoa xà thiệt thảo    | 20g    |\n| Bạch thược   | 15g     | Hương phụ           | 15g    |\n| Bạch linh   | 20g     | Sài hồ           | 10g    |\n| Toàn yết    | 6 g     | Ngô công           | 4g    |\n\n**Sắc uống mỗi ngày 1 thang, trị ung thư tuyến vú.**\n\n| Hải tảo  | 20g | Sơn từ cô        | 15g |\n|----------|-----|--------------------|-----|\n| Cúc hoa  | 15g  | Tạo giác thích      | 10g    |\n| Tam lăng   | 10g     | Nga truật    | 10g    |\n\n| Mã tiền tử   | 4g     | Sơn căn đậu           | 30g    |\n|----------    |--------|-----------------------|-----|\n\n**Sắc uống mỗi ngày 1 thang, trị các loại u bướu.**\n| Hải tảo  | 30g | Mẫu lệ       | 30g |\n|----------|-----|--------------------|-----|\n| Hoàng dược tử  | 30g  | Côn bố      | 15g    |\n| Miêu qua thảo   | 15g     |              |        |\n\n* *Sắc uống mỗi ngày 1 thang, trị ung thư tuyến mang tai.**\n\n| Hải tảo  | 30g | Côn bố       | 30g |\n|----------|-----|--------------------|-----|\n| Mẫu lệ  | 30g  | Toái bổ      | 30g    |\n| Hạ khô thảo   | 30g     | Thạch hộc  | 30g   |\n\n* *Sắc uống mỗi ngày 1 thang, trị u tế bào nội bì mạch máu.**\n\n| Hải tảo  | 15g | Đồi mồi       | 15g |\n|----------|-----|--------------------|-----|\n| Qui bản  | 15g  | Nha đảm tử      | 10g    |\n| Thiềm tô   | 6g     |         |    |\n\n* *Cho 4 vị trước lên ngói sấy khô vàng, thêm Thiềm tô tán bột trộn đều, uống mỗi ngày 2 lần, 1 lần 6g.**', '# **1. CÔN BỐ**\n\n* Tên khác.* **Hải côn bố, Hải đới, Nga chưởng thái.**\n\n* Tên khoa học.* **Laminaria japonica Aresch (Hải đới)**\n\n* Mô tả.* **Côn bố Laminaria japonica là loại tảo sống nhiều năm, thân dẹt, có màu nâu, có móc để bám vào đá, thân hình trụ, lá dẹt, mép có răng cưa nhỏ.**\n\n![](![id: cay-thuoc-vi-thuoc-phong-chua-benh-noi-tiet_img_012](cay-thuoc-vi-thuoc-phong-chua-benh-noi-tiet_img_012.png))\n\n* Hỉnh 8. Côn bố*\n* Tính năng công dụng và liều dùng.* **Côn bố vị mặn, tính hàn, có tác dụng nhuyễn kiên tán kết, hóa đờm tiêu tích. Do đờm khí kết tụ mà sinh tràng nhạc, hạch (bao gồm hạch limpo, sưng tuyến giáp trạng) có thể dùng côn bố phối với nguyên sâm, Sinh mẫu lệ, hạ khô thảo, bối mẫu, hoàng cầm, xích thược, hồng hoa, bách bộ, hải tảo...**\n\n* *Trong bụng do có đờm thực, huyết ứ tích lâu ngày thành cục mà sinh phỉ, tệ, mảng aíng (bao gồm sưng gan, lá lách, nang, sưng trong bụng, khối u...) có thể dùng côn bố với mai ba ba nướng, Sinh mẫu lệ, sinh hương phụ, thảo hồng hoa, cứu sơn giác, tiêu thần khúc, sơn tra hạch (hạt), đương quy, đào nhân, tam lăng, nga truật... để tiêu tán tích khối.**\n\n* *Nghiên cứu gần đây cho biết: côn bố có thể dùng vào chữa cường tuyến giáp trạng và sưng tuyến giáp trạng do thiếu iốt.**\n* *Hải tảo và côn bố có tác dụng gần giống nhau, tuy dược lực của hải tảo tương đối hòa hoãn, côn bố thì mạnh hơn mà lại hoạt lợi. Đối với loại hải tảo, côn bố, người thời xưa ăn nhiều chỉ có tác dụng giảm béo. Dùng chữa cho người béo, xơ vữa động mạch, huyết áp cao, có hiệu quả nhất định. Lượng dùng thường là 8 - 12g.**\n\n* Chú ý.* **Người tỳ vị hư hàn và hàn đờm tích tụ thì không nên dùng.**']","Hải tảo thường được dùng chữa bướu cổ do thiếu iốt. CONTEXT: ""Nghiên cứu gần đây cho biết: côn bố có thể dùng vào chữa cường tuyến giáp trạng và sưng tuyến giáp trạng do thiếu iốt. Hải tảo và côn bố có tác dụng gần giống nhau, tuy dược lực của hải tảo tương đối hòa hoãn, côn bố thì mạnh hơn mà lại hoạt lợi.""",Thiếu iod.,1,0.11775524,0.8,0.569376572
"Theo y học cổ truyền, Hải tảo có công năng nào giúp làm mềm và tiêu tán khối kết?","['# **4. HẢI TẢO**\n\n* Tên khác.* **Hải la, Hải đới hoa, Hải cao tử, Dương thể tháỉ.** *Tên khoa học.* **Sargassum pallidum (Tum).**\n\n* Mô tả:* **Hải tảo là cây sống nhiều năm cao 15-70mm, sợi phân nhánh giống như thân cây, màu nâu. Có những bộ phận mỏng, dẹt giống như lá, có răng cưa thô, trên mặt có những chấm đen. Tảo có những cái phao trông như quả giúp tảo đứng thắng trong nước biên.**\n* *Hải tảo mọc hoang ở vùng biển, nhiều nơi trong nước, dùng toàn cây làm thuốc.**\n\n* Tính vị, công năng liều dùng.* **Hải tảo có vị đắng, mặn, tính hàn, vào 3 kinh Can, Vị, Thận. Tác dụng làm mềm chất cứng (nhuyễn kiên) tiêu đàm, lợi thủy, trừ nhiệt. Trị** **ung thư tuyến giáp trạng, viêm phế quản mãn tính, bệnh mạch vành tìm, tích tụ, lao hạch lâm ba, thủy thũng, cước khí, sưng cao hoàn.**\n\n* *Liều dùng: 5 - 10g.**\n\n![](![id: cay-thuoc-vi-thuoc-phong-chua-benh-noi-tiet_img_015](cay-thuoc-vi-thuoc-phong-chua-benh-noi-tiet_img_015.png))\n\n* Hình 11. Hải tảo*\n\n* Ứng dụng:* **Ngoài dùng chữa bệnh nội tiết và chuyển hóa Hải tảo còn dùng trong các trường hợp.**\n\n| Hải tảo  | 30g | Bạch cương tàm | 30g |\n|----------|-----|----------------|-----|\n\n* *Các vị tán bột dùng Bạch mai làm viên, uống mỗi ngày 2-3 lần, mỗi lần 5-10g với nước cơm. Trị u hạch lâm ba.**\n\n| Hải tảo  | 15g | Thủy diệt      | 5g |\n|----------|-----|----------------|-----|\n**Hai vị tán bột uống với rượu, mỗi lần 5g, 1 ngày 2-3 lần. Trị ung thư thực quản.**\n\n| Hải tảo  | 15g | Côn bố         | 30g |\n|----------|-----|----------------|-----|\n| Thổ phục linh  | 30g |          |     |\n\n**Sắc uống với Tiểu kim phiến mỗi ngày 2 - 5-10g. Trị ung thư tuyến giáp, tuyến mang tai. 3 lần, 1 lần** \n| Hải tảo  | 15g | Hạ khô thảo        | 15g |\n|----------|-----|--------------------|-----|\n| Côn bố  | 15g  | Thổ phục linh      | 15g    |\n| Thạch vĩ  | 15g  |                  |     |\n\n**Sắc uống mỗi ngày 1 thang, trị u bướu ở khoang mắt.** \n| Hải tảo  | 30g | Hải đới        | 30g |\n|----------|-----|--------------------|-----|\n| Quyết minh tử  | 30g  | Nữ trinh tử      | 15g    |\n| Phục linh   | 20g     | Câu kỷ           | 10g    |\n| Thạch hộc   | 10g     | Thái tử sâm           | 10g    |\n\n**Sắc uống mỗi ngày 1 thang, trị ung thư tuyến vú.** \n| Hải tảo  | 20g | Côn bố        | 20g |\n|----------|-----|--------------------|-----|\n| Đương quy  | 20g  | Tục đoạn      | 20g    |\n| Bán chi liên   | 20g     | Bạch hoa xà thiệt thảo    | 20g    |\n| Bạch thược   | 15g     | Hương phụ           | 15g    |\n| Bạch linh   | 20g     | Sài hồ           | 10g    |\n| Toàn yết    | 6 g     | Ngô công           | 4g    |\n\n**Sắc uống mỗi ngày 1 thang, trị ung thư tuyến vú.**\n\n| Hải tảo  | 20g | Sơn từ cô        | 15g |\n|----------|-----|--------------------|-----|\n| Cúc hoa  | 15g  | Tạo giác thích      | 10g    |\n| Tam lăng   | 10g     | Nga truật    | 10g    |\n\n| Mã tiền tử   | 4g     | Sơn căn đậu           | 30g    |\n|----------    |--------|-----------------------|-----|\n\n**Sắc uống mỗi ngày 1 thang, trị các loại u bướu.**\n| Hải tảo  | 30g | Mẫu lệ       | 30g |\n|----------|-----|--------------------|-----|\n| Hoàng dược tử  | 30g  | Côn bố      | 15g    |\n| Miêu qua thảo   | 15g     |              |        |\n\n* *Sắc uống mỗi ngày 1 thang, trị ung thư tuyến mang tai.**\n\n| Hải tảo  | 30g | Côn bố       | 30g |\n|----------|-----|--------------------|-----|\n| Mẫu lệ  | 30g  | Toái bổ      | 30g    |\n| Hạ khô thảo   | 30g     | Thạch hộc  | 30g   |\n\n* *Sắc uống mỗi ngày 1 thang, trị u tế bào nội bì mạch máu.**\n\n| Hải tảo  | 15g | Đồi mồi       | 15g |\n|----------|-----|--------------------|-----|\n| Qui bản  | 15g  | Nha đảm tử      | 10g    |\n| Thiềm tô   | 6g     |         |    |\n\n* *Cho 4 vị trước lên ngói sấy khô vàng, thêm Thiềm tô tán bột trộn đều, uống mỗi ngày 2 lần, 1 lần 6g.**', '#### **Các bài thuốc kinh nghiệm dân gian:**\n\n- **\\* Hải đới 250g. Rửa sạch, dùng lửa nhỏ nấu đặc thành cao, bỏ xác, uống ngày 1 thang.**\n- **\\* Hải tảo 500g, Hải đới 500g rửa sạch sấy khô tán bột mịn. Mỗi ngày uống 10g với nước sôi nguội. Hải tảo**\n\n* *không được dùng chung với Cam thảo.**\n- **\\* Côn bố 30g, Toàn yết (Bò cạp) 1 con. Côn bố sắc bỏ xác, Toàn yết, nung cháy tán bột. Nước sắc thuốc uống với bột Bò cạp mỗi sáng 1 lần, liên tục 10 ngày.**\n- **\\* Côn bố 15g, Hải tảo 15g, Mẫu lệ 15g. sắc uống, ngày 1 thang liên tục trong nhiều ngày. Dùng lốt cho thể can khí uất.**\n- **\\* Sài hồ 9g, Phật thủ 9g, Uất kim 15g, Hải tảo 15g. sắc bỏ xác, cho gạo nấu cháo thêm đường mía uống, ngày 1 thang, liên tục trong 10-15 ngày.**\n- **\\* Hạ khô thảo 100g, Sa sâm 30g, Mạch môn 30g, Sinh địa 30g, Huyền sâm 30g, Hải tảo 50g. sắc 2 lần được 500ml, cho đường trắng nấu cao. Mỗi lần uống 20ml, ngày 3 lần.**\n- **\\* Xuyên bối 15g, Côn bố 15g, Đơn sâm 15g, Ý dĩ 30g, Đông qua 60g, Đường đỏ vừa đủ. Hai vị sắc nước, bỏ bã, các vị sau cho vào nấu cháo ăn, ngày 1 thang, liên tục uống 15-20 thang. Dùng cho thể đàm thấp kết tụ.**\n- **\\* Hải tảo 15g, Hải đới 15g, Thịt hàu (mẫu lệ nhục) 60g. Hai vị đầu rửa sạch cát cho thịt hàu vào nấu chín ăn thịt uống nước. Dùng tốt cho bệnh nhân trẻ tuổi mắc bệnh thể cường giáp thiếu iốt.**\n- **\\* Đậu xanh 60g, Hải đới 30g, Gạo 30g, Trần bì 6g, Đường đỏ 60g. sắc chính đậu xanh nở mềm là ăn được.**\n- **\\* Hạ khô thảo 20g, Mẫu lệ 15g, Hải tảo 10g, Côn bố 10g. Sắc uống kèm theo uống Bổ Tâm đơn.**\n| *Hoàng kỳ  | 30g  | Hạ khô thảo  | 30g |\n|-------------|------|--------------|-----|\n| Đảng sâm    | 20g  | Miết giáp    | 15g |\n| Quy bản     | 12g  | Thủ ô        | 12g |\n| Sinh địa    | 12g  | Bạch thược   | 12g |\n| Hoài sơn    | 12   | Hương phụ    | 12g |\n\n* *Sắc uống. Dùng cho bệnh nhân kèm tuyến giáp to**\n\n| * Đương quy | 10g  | Chi tử     | 10g  |\n|--------------|------|-------------|------|\n| Bạch truật   | 10g  | M ãnkinh tử | 10g  |\n| U ấtkừn      | 10g  | Sài hồ     | 12g |\n| Đơn sâm      | 12g | Bạch thược  | 12g  |\n| Hoàng cầm   | 12g | Lá Bạc hà   | 6g   |\n| Cam thảo     | ^8   |             |      |\n\n* *sắc uống ngày 1 thang, 10 ngày là một liệu trình.**\n\n| *Đương quy    | 10g | Sinh hoàng kỳ | 30g |\n|---------------|-----|---------------|-----|\n| Sinh thục địa | 10g | Hoàng bá      | 10g |\n| Hoàng cầm     | 10g | Ngũ vị tử     | 10g |\n| Đơn bì        | 10g | Sinh mẫu lệ   | 10g |\n| Bạch đầu ông  | 30g | Hạ khô thảo   | 15g |\n\n* *Sắc uống. Dùng cho bệnh nhân hồi hộp, mệt mỏi, ăn uống nhiều, tuyến giáp to.**\n\n| *Đương quy   | 10g  | Sinh hoàng kỳ | 30g |\n|---------------|-----|---------------|-----|\n| Sinh thục địa | 10g | Hoàng bá      | 10g |\n| Hoàng cầm     | 10g | Ngũ vị tử     | 10g |\n| Đơn bì        | 10g | Sinh mẫu lệ   | 30g |\n| Bạch đầu ông  | 30g | Hạ khô thảo   | 15g |\n\n* *Sắc uống. Dùng cho bệnh nhân hồi hộp, mệt mỏi, ăn uống nhiều, tuyến giáp to.**\n\n| *Đương quy    | 30g | Mạch đông   | 30g |\n|---------------|-----|-------------|-----|\n| Ngũ vị        | 30g | Đảng sâm    | 30g |\n| Tam lăng      | 30g | Côn bố      | 30g |\n| Hải tảo       | 30g | Nga truật   | 30g |\n| Ngọc trúc     | 30g | Ô mai       | 30g |\n| Sinh thục địa | 30g | Hoàng cầm   | 30g |\n| Hoàng liên    | 30g | Hoàng bá    | 30g |\n| Bạch đầu ông  | 60g | Sinh Mẫu lệ | 50g |\n| Lệ chi hạch   | 50g | Quất hạch   | 50g |\n| Sinh hoàng kỳ | 90g | Hạ khô thảo | 90g |\n|               |     |             |     |\n* *Tất cả tán bột mịn, hoàn mật, mỗi hoàn 10g. Mỗi lần uống 1 hoàn.**\n\n| * Sinh hoàng kỳ     | 20g | Đương quy   | 10g |\n|---------------------|-----|-------------|-----|\n| Sinh thục địa       | 10g | Hoàng cầm   | 10g |\n| Hoàng liên          | 3g  | Hoàng bá    | 10g |\n| Quất hạch           | 10g | Lệ chi hạch | 10g |\n| Hạ khô thảo         | 20g | Mẫu lệ      | 30g |\n| Bạch đầu ông        | 30g |             |     |\n* *Sắc uống.**           \n| *Đảng sâm          | 30g | Chỉ xác     | 30g |\n| Ô mai              | 30g | Côn bố      | 30g |\n| Mạch môn           | 30g | Ngũ vị tử   | 30g |\n| Quất hạch          | 30g | Lệ chi hạch | 30g |\n| Hải tảo            | 30g | Hạ khô tháo | 30g |\n| Đơn sâm            | 90g | Quy bản     | 60g |\n| Bạch đầu ông       | 60g |             |     |\n|                     |     |             |     |\n\n* *Tất cả tán bột làm hoán nặng 10g. Uống sáng, trưa, tối mỗi lần 1 hoàn.**', '# **1. CÔN BỐ**\n\n* Tên khác.* **Hải côn bố, Hải đới, Nga chưởng thái.**\n\n* Tên khoa học.* **Laminaria japonica Aresch (Hải đới)**\n\n* Mô tả.* **Côn bố Laminaria japonica là loại tảo sống nhiều năm, thân dẹt, có màu nâu, có móc để bám vào đá, thân hình trụ, lá dẹt, mép có răng cưa nhỏ.**\n\n![](![id: cay-thuoc-vi-thuoc-phong-chua-benh-noi-tiet_img_012](cay-thuoc-vi-thuoc-phong-chua-benh-noi-tiet_img_012.png))\n\n* Hỉnh 8. Côn bố*\n* Tính năng công dụng và liều dùng.* **Côn bố vị mặn, tính hàn, có tác dụng nhuyễn kiên tán kết, hóa đờm tiêu tích. Do đờm khí kết tụ mà sinh tràng nhạc, hạch (bao gồm hạch limpo, sưng tuyến giáp trạng) có thể dùng côn bố phối với nguyên sâm, Sinh mẫu lệ, hạ khô thảo, bối mẫu, hoàng cầm, xích thược, hồng hoa, bách bộ, hải tảo...**\n\n* *Trong bụng do có đờm thực, huyết ứ tích lâu ngày thành cục mà sinh phỉ, tệ, mảng aíng (bao gồm sưng gan, lá lách, nang, sưng trong bụng, khối u...) có thể dùng côn bố với mai ba ba nướng, Sinh mẫu lệ, sinh hương phụ, thảo hồng hoa, cứu sơn giác, tiêu thần khúc, sơn tra hạch (hạt), đương quy, đào nhân, tam lăng, nga truật... để tiêu tán tích khối.**\n\n* *Nghiên cứu gần đây cho biết: côn bố có thể dùng vào chữa cường tuyến giáp trạng và sưng tuyến giáp trạng do thiếu iốt.**\n* *Hải tảo và côn bố có tác dụng gần giống nhau, tuy dược lực của hải tảo tương đối hòa hoãn, côn bố thì mạnh hơn mà lại hoạt lợi. Đối với loại hải tảo, côn bố, người thời xưa ăn nhiều chỉ có tác dụng giảm béo. Dùng chữa cho người béo, xơ vữa động mạch, huyết áp cao, có hiệu quả nhất định. Lượng dùng thường là 8 - 12g.**\n\n* Chú ý.* **Người tỳ vị hư hàn và hàn đờm tích tụ thì không nên dùng.**']","Theo y học cổ truyền, Hải tảo có công năng làm mềm (nhuyễn kiên) và tiêu tán khối kết (tiêu tích). Đặc biệt, Hải tảo được sử dụng để làm mềm và tiêu tán các khối u, bướu, và các tình trạng tích tụ khác như trong các trường hợp ung thư tuyến giáp, ung thư thực quản, ung thư tuyến vú, và các u bướu khác.",Nhuyễn kiên tán kết.,1,0.413436847,0.5,0.613235633
"Theo y học cổ truyền, Hải tảo có tác dụng gì đối với đờm?","['# **4. HẢI TẢO**\n\n* Tên khác.* **Hải la, Hải đới hoa, Hải cao tử, Dương thể tháỉ.** *Tên khoa học.* **Sargassum pallidum (Tum).**\n\n* Mô tả:* **Hải tảo là cây sống nhiều năm cao 15-70mm, sợi phân nhánh giống như thân cây, màu nâu. Có những bộ phận mỏng, dẹt giống như lá, có răng cưa thô, trên mặt có những chấm đen. Tảo có những cái phao trông như quả giúp tảo đứng thắng trong nước biên.**\n* *Hải tảo mọc hoang ở vùng biển, nhiều nơi trong nước, dùng toàn cây làm thuốc.**\n\n* Tính vị, công năng liều dùng.* **Hải tảo có vị đắng, mặn, tính hàn, vào 3 kinh Can, Vị, Thận. Tác dụng làm mềm chất cứng (nhuyễn kiên) tiêu đàm, lợi thủy, trừ nhiệt. Trị** **ung thư tuyến giáp trạng, viêm phế quản mãn tính, bệnh mạch vành tìm, tích tụ, lao hạch lâm ba, thủy thũng, cước khí, sưng cao hoàn.**\n\n* *Liều dùng: 5 - 10g.**\n\n![](![id: cay-thuoc-vi-thuoc-phong-chua-benh-noi-tiet_img_015](cay-thuoc-vi-thuoc-phong-chua-benh-noi-tiet_img_015.png))\n\n* Hình 11. Hải tảo*\n\n* Ứng dụng:* **Ngoài dùng chữa bệnh nội tiết và chuyển hóa Hải tảo còn dùng trong các trường hợp.**\n\n| Hải tảo  | 30g | Bạch cương tàm | 30g |\n|----------|-----|----------------|-----|\n\n* *Các vị tán bột dùng Bạch mai làm viên, uống mỗi ngày 2-3 lần, mỗi lần 5-10g với nước cơm. Trị u hạch lâm ba.**\n\n| Hải tảo  | 15g | Thủy diệt      | 5g |\n|----------|-----|----------------|-----|\n**Hai vị tán bột uống với rượu, mỗi lần 5g, 1 ngày 2-3 lần. Trị ung thư thực quản.**\n\n| Hải tảo  | 15g | Côn bố         | 30g |\n|----------|-----|----------------|-----|\n| Thổ phục linh  | 30g |          |     |\n\n**Sắc uống với Tiểu kim phiến mỗi ngày 2 - 5-10g. Trị ung thư tuyến giáp, tuyến mang tai. 3 lần, 1 lần** \n| Hải tảo  | 15g | Hạ khô thảo        | 15g |\n|----------|-----|--------------------|-----|\n| Côn bố  | 15g  | Thổ phục linh      | 15g    |\n| Thạch vĩ  | 15g  |                  |     |\n\n**Sắc uống mỗi ngày 1 thang, trị u bướu ở khoang mắt.** \n| Hải tảo  | 30g | Hải đới        | 30g |\n|----------|-----|--------------------|-----|\n| Quyết minh tử  | 30g  | Nữ trinh tử      | 15g    |\n| Phục linh   | 20g     | Câu kỷ           | 10g    |\n| Thạch hộc   | 10g     | Thái tử sâm           | 10g    |\n\n**Sắc uống mỗi ngày 1 thang, trị ung thư tuyến vú.** \n| Hải tảo  | 20g | Côn bố        | 20g |\n|----------|-----|--------------------|-----|\n| Đương quy  | 20g  | Tục đoạn      | 20g    |\n| Bán chi liên   | 20g     | Bạch hoa xà thiệt thảo    | 20g    |\n| Bạch thược   | 15g     | Hương phụ           | 15g    |\n| Bạch linh   | 20g     | Sài hồ           | 10g    |\n| Toàn yết    | 6 g     | Ngô công           | 4g    |\n\n**Sắc uống mỗi ngày 1 thang, trị ung thư tuyến vú.**\n\n| Hải tảo  | 20g | Sơn từ cô        | 15g |\n|----------|-----|--------------------|-----|\n| Cúc hoa  | 15g  | Tạo giác thích      | 10g    |\n| Tam lăng   | 10g     | Nga truật    | 10g    |\n\n| Mã tiền tử   | 4g     | Sơn căn đậu           | 30g    |\n|----------    |--------|-----------------------|-----|\n\n**Sắc uống mỗi ngày 1 thang, trị các loại u bướu.**\n| Hải tảo  | 30g | Mẫu lệ       | 30g |\n|----------|-----|--------------------|-----|\n| Hoàng dược tử  | 30g  | Côn bố      | 15g    |\n| Miêu qua thảo   | 15g     |              |        |\n\n* *Sắc uống mỗi ngày 1 thang, trị ung thư tuyến mang tai.**\n\n| Hải tảo  | 30g | Côn bố       | 30g |\n|----------|-----|--------------------|-----|\n| Mẫu lệ  | 30g  | Toái bổ      | 30g    |\n| Hạ khô thảo   | 30g     | Thạch hộc  | 30g   |\n\n* *Sắc uống mỗi ngày 1 thang, trị u tế bào nội bì mạch máu.**\n\n| Hải tảo  | 15g | Đồi mồi       | 15g |\n|----------|-----|--------------------|-----|\n| Qui bản  | 15g  | Nha đảm tử      | 10g    |\n| Thiềm tô   | 6g     |         |    |\n\n* *Cho 4 vị trước lên ngói sấy khô vàng, thêm Thiềm tô tán bột trộn đều, uống mỗi ngày 2 lần, 1 lần 6g.**', '# **1. CÔN BỐ**\n\n* Tên khác.* **Hải côn bố, Hải đới, Nga chưởng thái.**\n\n* Tên khoa học.* **Laminaria japonica Aresch (Hải đới)**\n\n* Mô tả.* **Côn bố Laminaria japonica là loại tảo sống nhiều năm, thân dẹt, có màu nâu, có móc để bám vào đá, thân hình trụ, lá dẹt, mép có răng cưa nhỏ.**\n\n![](![id: cay-thuoc-vi-thuoc-phong-chua-benh-noi-tiet_img_012](cay-thuoc-vi-thuoc-phong-chua-benh-noi-tiet_img_012.png))\n\n* Hỉnh 8. Côn bố*\n* Tính năng công dụng và liều dùng.* **Côn bố vị mặn, tính hàn, có tác dụng nhuyễn kiên tán kết, hóa đờm tiêu tích. Do đờm khí kết tụ mà sinh tràng nhạc, hạch (bao gồm hạch limpo, sưng tuyến giáp trạng) có thể dùng côn bố phối với nguyên sâm, Sinh mẫu lệ, hạ khô thảo, bối mẫu, hoàng cầm, xích thược, hồng hoa, bách bộ, hải tảo...**\n\n* *Trong bụng do có đờm thực, huyết ứ tích lâu ngày thành cục mà sinh phỉ, tệ, mảng aíng (bao gồm sưng gan, lá lách, nang, sưng trong bụng, khối u...) có thể dùng côn bố với mai ba ba nướng, Sinh mẫu lệ, sinh hương phụ, thảo hồng hoa, cứu sơn giác, tiêu thần khúc, sơn tra hạch (hạt), đương quy, đào nhân, tam lăng, nga truật... để tiêu tán tích khối.**\n\n* *Nghiên cứu gần đây cho biết: côn bố có thể dùng vào chữa cường tuyến giáp trạng và sưng tuyến giáp trạng do thiếu iốt.**\n* *Hải tảo và côn bố có tác dụng gần giống nhau, tuy dược lực của hải tảo tương đối hòa hoãn, côn bố thì mạnh hơn mà lại hoạt lợi. Đối với loại hải tảo, côn bố, người thời xưa ăn nhiều chỉ có tác dụng giảm béo. Dùng chữa cho người béo, xơ vữa động mạch, huyết áp cao, có hiệu quả nhất định. Lượng dùng thường là 8 - 12g.**\n\n* Chú ý.* **Người tỳ vị hư hàn và hàn đờm tích tụ thì không nên dùng.**', '#### **Các bài thuốc kinh nghiệm dân gian:**\n\n- **\\* Hải đới 250g. Rửa sạch, dùng lửa nhỏ nấu đặc thành cao, bỏ xác, uống ngày 1 thang.**\n- **\\* Hải tảo 500g, Hải đới 500g rửa sạch sấy khô tán bột mịn. Mỗi ngày uống 10g với nước sôi nguội. Hải tảo**\n\n* *không được dùng chung với Cam thảo.**\n- **\\* Côn bố 30g, Toàn yết (Bò cạp) 1 con. Côn bố sắc bỏ xác, Toàn yết, nung cháy tán bột. Nước sắc thuốc uống với bột Bò cạp mỗi sáng 1 lần, liên tục 10 ngày.**\n- **\\* Côn bố 15g, Hải tảo 15g, Mẫu lệ 15g. sắc uống, ngày 1 thang liên tục trong nhiều ngày. Dùng lốt cho thể can khí uất.**\n- **\\* Sài hồ 9g, Phật thủ 9g, Uất kim 15g, Hải tảo 15g. sắc bỏ xác, cho gạo nấu cháo thêm đường mía uống, ngày 1 thang, liên tục trong 10-15 ngày.**\n- **\\* Hạ khô thảo 100g, Sa sâm 30g, Mạch môn 30g, Sinh địa 30g, Huyền sâm 30g, Hải tảo 50g. sắc 2 lần được 500ml, cho đường trắng nấu cao. Mỗi lần uống 20ml, ngày 3 lần.**\n- **\\* Xuyên bối 15g, Côn bố 15g, Đơn sâm 15g, Ý dĩ 30g, Đông qua 60g, Đường đỏ vừa đủ. Hai vị sắc nước, bỏ bã, các vị sau cho vào nấu cháo ăn, ngày 1 thang, liên tục uống 15-20 thang. Dùng cho thể đàm thấp kết tụ.**\n- **\\* Hải tảo 15g, Hải đới 15g, Thịt hàu (mẫu lệ nhục) 60g. Hai vị đầu rửa sạch cát cho thịt hàu vào nấu chín ăn thịt uống nước. Dùng tốt cho bệnh nhân trẻ tuổi mắc bệnh thể cường giáp thiếu iốt.**\n- **\\* Đậu xanh 60g, Hải đới 30g, Gạo 30g, Trần bì 6g, Đường đỏ 60g. sắc chính đậu xanh nở mềm là ăn được.**\n- **\\* Hạ khô thảo 20g, Mẫu lệ 15g, Hải tảo 10g, Côn bố 10g. Sắc uống kèm theo uống Bổ Tâm đơn.**\n| *Hoàng kỳ  | 30g  | Hạ khô thảo  | 30g |\n|-------------|------|--------------|-----|\n| Đảng sâm    | 20g  | Miết giáp    | 15g |\n| Quy bản     | 12g  | Thủ ô        | 12g |\n| Sinh địa    | 12g  | Bạch thược   | 12g |\n| Hoài sơn    | 12   | Hương phụ    | 12g |\n\n* *Sắc uống. Dùng cho bệnh nhân kèm tuyến giáp to**\n\n| * Đương quy | 10g  | Chi tử     | 10g  |\n|--------------|------|-------------|------|\n| Bạch truật   | 10g  | M ãnkinh tử | 10g  |\n| U ấtkừn      | 10g  | Sài hồ     | 12g |\n| Đơn sâm      | 12g | Bạch thược  | 12g  |\n| Hoàng cầm   | 12g | Lá Bạc hà   | 6g   |\n| Cam thảo     | ^8   |             |      |\n\n* *sắc uống ngày 1 thang, 10 ngày là một liệu trình.**\n\n| *Đương quy    | 10g | Sinh hoàng kỳ | 30g |\n|---------------|-----|---------------|-----|\n| Sinh thục địa | 10g | Hoàng bá      | 10g |\n| Hoàng cầm     | 10g | Ngũ vị tử     | 10g |\n| Đơn bì        | 10g | Sinh mẫu lệ   | 10g |\n| Bạch đầu ông  | 30g | Hạ khô thảo   | 15g |\n\n* *Sắc uống. Dùng cho bệnh nhân hồi hộp, mệt mỏi, ăn uống nhiều, tuyến giáp to.**\n\n| *Đương quy   | 10g  | Sinh hoàng kỳ | 30g |\n|---------------|-----|---------------|-----|\n| Sinh thục địa | 10g | Hoàng bá      | 10g |\n| Hoàng cầm     | 10g | Ngũ vị tử     | 10g |\n| Đơn bì        | 10g | Sinh mẫu lệ   | 30g |\n| Bạch đầu ông  | 30g | Hạ khô thảo   | 15g |\n\n* *Sắc uống. Dùng cho bệnh nhân hồi hộp, mệt mỏi, ăn uống nhiều, tuyến giáp to.**\n\n| *Đương quy    | 30g | Mạch đông   | 30g |\n|---------------|-----|-------------|-----|\n| Ngũ vị        | 30g | Đảng sâm    | 30g |\n| Tam lăng      | 30g | Côn bố      | 30g |\n| Hải tảo       | 30g | Nga truật   | 30g |\n| Ngọc trúc     | 30g | Ô mai       | 30g |\n| Sinh thục địa | 30g | Hoàng cầm   | 30g |\n| Hoàng liên    | 30g | Hoàng bá    | 30g |\n| Bạch đầu ông  | 60g | Sinh Mẫu lệ | 50g |\n| Lệ chi hạch   | 50g | Quất hạch   | 50g |\n| Sinh hoàng kỳ | 90g | Hạ khô thảo | 90g |\n|               |     |             |     |\n* *Tất cả tán bột mịn, hoàn mật, mỗi hoàn 10g. Mỗi lần uống 1 hoàn.**\n\n| * Sinh hoàng kỳ     | 20g | Đương quy   | 10g |\n|---------------------|-----|-------------|-----|\n| Sinh thục địa       | 10g | Hoàng cầm   | 10g |\n| Hoàng liên          | 3g  | Hoàng bá    | 10g |\n| Quất hạch           | 10g | Lệ chi hạch | 10g |\n| Hạ khô thảo         | 20g | Mẫu lệ      | 30g |\n| Bạch đầu ông        | 30g |             |     |\n* *Sắc uống.**           \n| *Đảng sâm          | 30g | Chỉ xác     | 30g |\n| Ô mai              | 30g | Côn bố      | 30g |\n| Mạch môn           | 30g | Ngũ vị tử   | 30g |\n| Quất hạch          | 30g | Lệ chi hạch | 30g |\n| Hải tảo            | 30g | Hạ khô tháo | 30g |\n| Đơn sâm            | 90g | Quy bản     | 60g |\n| Bạch đầu ông       | 60g |             |     |\n|                     |     |             |     |\n\n* *Tất cả tán bột làm hoán nặng 10g. Uống sáng, trưa, tối mỗi lần 1 hoàn.**']","Theo y học cổ truyền, Hải tảo có tác dụng nhuyễn kiên (làm mềm chất cứng), tiêu đàm (loại bỏ đờm), lợi thủy (thúc đẩy nước trong cơ thể ra ngoài), và trừ nhiệt (giảm nhiệt trong cơ thể). Đặc biệt, Hải tảo được sử dụng để điều trị các tình trạng liên quan đến đờm như ung thư tuyến giáp trạng, viêm phế quản mãn tính, bệnh mạch vành, và các tình trạng tích tụ đờm khác.",Tiêu đờm.,1,0.312028096,0.5,0.8956016
"Theo y học cổ truyền, Hải tảo có tác dụng gì đối với thủy dịch?","['# **4. HẢI TẢO**\n\n* Tên khác.* **Hải la, Hải đới hoa, Hải cao tử, Dương thể tháỉ.** *Tên khoa học.* **Sargassum pallidum (Tum).**\n\n* Mô tả:* **Hải tảo là cây sống nhiều năm cao 15-70mm, sợi phân nhánh giống như thân cây, màu nâu. Có những bộ phận mỏng, dẹt giống như lá, có răng cưa thô, trên mặt có những chấm đen. Tảo có những cái phao trông như quả giúp tảo đứng thắng trong nước biên.**\n* *Hải tảo mọc hoang ở vùng biển, nhiều nơi trong nước, dùng toàn cây làm thuốc.**\n\n* Tính vị, công năng liều dùng.* **Hải tảo có vị đắng, mặn, tính hàn, vào 3 kinh Can, Vị, Thận. Tác dụng làm mềm chất cứng (nhuyễn kiên) tiêu đàm, lợi thủy, trừ nhiệt. Trị** **ung thư tuyến giáp trạng, viêm phế quản mãn tính, bệnh mạch vành tìm, tích tụ, lao hạch lâm ba, thủy thũng, cước khí, sưng cao hoàn.**\n\n* *Liều dùng: 5 - 10g.**\n\n![](![id: cay-thuoc-vi-thuoc-phong-chua-benh-noi-tiet_img_015](cay-thuoc-vi-thuoc-phong-chua-benh-noi-tiet_img_015.png))\n\n* Hình 11. Hải tảo*\n\n* Ứng dụng:* **Ngoài dùng chữa bệnh nội tiết và chuyển hóa Hải tảo còn dùng trong các trường hợp.**\n\n| Hải tảo  | 30g | Bạch cương tàm | 30g |\n|----------|-----|----------------|-----|\n\n* *Các vị tán bột dùng Bạch mai làm viên, uống mỗi ngày 2-3 lần, mỗi lần 5-10g với nước cơm. Trị u hạch lâm ba.**\n\n| Hải tảo  | 15g | Thủy diệt      | 5g |\n|----------|-----|----------------|-----|\n**Hai vị tán bột uống với rượu, mỗi lần 5g, 1 ngày 2-3 lần. Trị ung thư thực quản.**\n\n| Hải tảo  | 15g | Côn bố         | 30g |\n|----------|-----|----------------|-----|\n| Thổ phục linh  | 30g |          |     |\n\n**Sắc uống với Tiểu kim phiến mỗi ngày 2 - 5-10g. Trị ung thư tuyến giáp, tuyến mang tai. 3 lần, 1 lần** \n| Hải tảo  | 15g | Hạ khô thảo        | 15g |\n|----------|-----|--------------------|-----|\n| Côn bố  | 15g  | Thổ phục linh      | 15g    |\n| Thạch vĩ  | 15g  |                  |     |\n\n**Sắc uống mỗi ngày 1 thang, trị u bướu ở khoang mắt.** \n| Hải tảo  | 30g | Hải đới        | 30g |\n|----------|-----|--------------------|-----|\n| Quyết minh tử  | 30g  | Nữ trinh tử      | 15g    |\n| Phục linh   | 20g     | Câu kỷ           | 10g    |\n| Thạch hộc   | 10g     | Thái tử sâm           | 10g    |\n\n**Sắc uống mỗi ngày 1 thang, trị ung thư tuyến vú.** \n| Hải tảo  | 20g | Côn bố        | 20g |\n|----------|-----|--------------------|-----|\n| Đương quy  | 20g  | Tục đoạn      | 20g    |\n| Bán chi liên   | 20g     | Bạch hoa xà thiệt thảo    | 20g    |\n| Bạch thược   | 15g     | Hương phụ           | 15g    |\n| Bạch linh   | 20g     | Sài hồ           | 10g    |\n| Toàn yết    | 6 g     | Ngô công           | 4g    |\n\n**Sắc uống mỗi ngày 1 thang, trị ung thư tuyến vú.**\n\n| Hải tảo  | 20g | Sơn từ cô        | 15g |\n|----------|-----|--------------------|-----|\n| Cúc hoa  | 15g  | Tạo giác thích      | 10g    |\n| Tam lăng   | 10g     | Nga truật    | 10g    |\n\n| Mã tiền tử   | 4g     | Sơn căn đậu           | 30g    |\n|----------    |--------|-----------------------|-----|\n\n**Sắc uống mỗi ngày 1 thang, trị các loại u bướu.**\n| Hải tảo  | 30g | Mẫu lệ       | 30g |\n|----------|-----|--------------------|-----|\n| Hoàng dược tử  | 30g  | Côn bố      | 15g    |\n| Miêu qua thảo   | 15g     |              |        |\n\n* *Sắc uống mỗi ngày 1 thang, trị ung thư tuyến mang tai.**\n\n| Hải tảo  | 30g | Côn bố       | 30g |\n|----------|-----|--------------------|-----|\n| Mẫu lệ  | 30g  | Toái bổ      | 30g    |\n| Hạ khô thảo   | 30g     | Thạch hộc  | 30g   |\n\n* *Sắc uống mỗi ngày 1 thang, trị u tế bào nội bì mạch máu.**\n\n| Hải tảo  | 15g | Đồi mồi       | 15g |\n|----------|-----|--------------------|-----|\n| Qui bản  | 15g  | Nha đảm tử      | 10g    |\n| Thiềm tô   | 6g     |         |    |\n\n* *Cho 4 vị trước lên ngói sấy khô vàng, thêm Thiềm tô tán bột trộn đều, uống mỗi ngày 2 lần, 1 lần 6g.**', '#### **Các bài thuốc kinh nghiệm dân gian:**\n\n- **\\* Hải đới 250g. Rửa sạch, dùng lửa nhỏ nấu đặc thành cao, bỏ xác, uống ngày 1 thang.**\n- **\\* Hải tảo 500g, Hải đới 500g rửa sạch sấy khô tán bột mịn. Mỗi ngày uống 10g với nước sôi nguội. Hải tảo**\n\n* *không được dùng chung với Cam thảo.**\n- **\\* Côn bố 30g, Toàn yết (Bò cạp) 1 con. Côn bố sắc bỏ xác, Toàn yết, nung cháy tán bột. Nước sắc thuốc uống với bột Bò cạp mỗi sáng 1 lần, liên tục 10 ngày.**\n- **\\* Côn bố 15g, Hải tảo 15g, Mẫu lệ 15g. sắc uống, ngày 1 thang liên tục trong nhiều ngày. Dùng lốt cho thể can khí uất.**\n- **\\* Sài hồ 9g, Phật thủ 9g, Uất kim 15g, Hải tảo 15g. sắc bỏ xác, cho gạo nấu cháo thêm đường mía uống, ngày 1 thang, liên tục trong 10-15 ngày.**\n- **\\* Hạ khô thảo 100g, Sa sâm 30g, Mạch môn 30g, Sinh địa 30g, Huyền sâm 30g, Hải tảo 50g. sắc 2 lần được 500ml, cho đường trắng nấu cao. Mỗi lần uống 20ml, ngày 3 lần.**\n- **\\* Xuyên bối 15g, Côn bố 15g, Đơn sâm 15g, Ý dĩ 30g, Đông qua 60g, Đường đỏ vừa đủ. Hai vị sắc nước, bỏ bã, các vị sau cho vào nấu cháo ăn, ngày 1 thang, liên tục uống 15-20 thang. Dùng cho thể đàm thấp kết tụ.**\n- **\\* Hải tảo 15g, Hải đới 15g, Thịt hàu (mẫu lệ nhục) 60g. Hai vị đầu rửa sạch cát cho thịt hàu vào nấu chín ăn thịt uống nước. Dùng tốt cho bệnh nhân trẻ tuổi mắc bệnh thể cường giáp thiếu iốt.**\n- **\\* Đậu xanh 60g, Hải đới 30g, Gạo 30g, Trần bì 6g, Đường đỏ 60g. sắc chính đậu xanh nở mềm là ăn được.**\n- **\\* Hạ khô thảo 20g, Mẫu lệ 15g, Hải tảo 10g, Côn bố 10g. Sắc uống kèm theo uống Bổ Tâm đơn.**\n| *Hoàng kỳ  | 30g  | Hạ khô thảo  | 30g |\n|-------------|------|--------------|-----|\n| Đảng sâm    | 20g  | Miết giáp    | 15g |\n| Quy bản     | 12g  | Thủ ô        | 12g |\n| Sinh địa    | 12g  | Bạch thược   | 12g |\n| Hoài sơn    | 12   | Hương phụ    | 12g |\n\n* *Sắc uống. Dùng cho bệnh nhân kèm tuyến giáp to**\n\n| * Đương quy | 10g  | Chi tử     | 10g  |\n|--------------|------|-------------|------|\n| Bạch truật   | 10g  | M ãnkinh tử | 10g  |\n| U ấtkừn      | 10g  | Sài hồ     | 12g |\n| Đơn sâm      | 12g | Bạch thược  | 12g  |\n| Hoàng cầm   | 12g | Lá Bạc hà   | 6g   |\n| Cam thảo     | ^8   |             |      |\n\n* *sắc uống ngày 1 thang, 10 ngày là một liệu trình.**\n\n| *Đương quy    | 10g | Sinh hoàng kỳ | 30g |\n|---------------|-----|---------------|-----|\n| Sinh thục địa | 10g | Hoàng bá      | 10g |\n| Hoàng cầm     | 10g | Ngũ vị tử     | 10g |\n| Đơn bì        | 10g | Sinh mẫu lệ   | 10g |\n| Bạch đầu ông  | 30g | Hạ khô thảo   | 15g |\n\n* *Sắc uống. Dùng cho bệnh nhân hồi hộp, mệt mỏi, ăn uống nhiều, tuyến giáp to.**\n\n| *Đương quy   | 10g  | Sinh hoàng kỳ | 30g |\n|---------------|-----|---------------|-----|\n| Sinh thục địa | 10g | Hoàng bá      | 10g |\n| Hoàng cầm     | 10g | Ngũ vị tử     | 10g |\n| Đơn bì        | 10g | Sinh mẫu lệ   | 30g |\n| Bạch đầu ông  | 30g | Hạ khô thảo   | 15g |\n\n* *Sắc uống. Dùng cho bệnh nhân hồi hộp, mệt mỏi, ăn uống nhiều, tuyến giáp to.**\n\n| *Đương quy    | 30g | Mạch đông   | 30g |\n|---------------|-----|-------------|-----|\n| Ngũ vị        | 30g | Đảng sâm    | 30g |\n| Tam lăng      | 30g | Côn bố      | 30g |\n| Hải tảo       | 30g | Nga truật   | 30g |\n| Ngọc trúc     | 30g | Ô mai       | 30g |\n| Sinh thục địa | 30g | Hoàng cầm   | 30g |\n| Hoàng liên    | 30g | Hoàng bá    | 30g |\n| Bạch đầu ông  | 60g | Sinh Mẫu lệ | 50g |\n| Lệ chi hạch   | 50g | Quất hạch   | 50g |\n| Sinh hoàng kỳ | 90g | Hạ khô thảo | 90g |\n|               |     |             |     |\n* *Tất cả tán bột mịn, hoàn mật, mỗi hoàn 10g. Mỗi lần uống 1 hoàn.**\n\n| * Sinh hoàng kỳ     | 20g | Đương quy   | 10g |\n|---------------------|-----|-------------|-----|\n| Sinh thục địa       | 10g | Hoàng cầm   | 10g |\n| Hoàng liên          | 3g  | Hoàng bá    | 10g |\n| Quất hạch           | 10g | Lệ chi hạch | 10g |\n| Hạ khô thảo         | 20g | Mẫu lệ      | 30g |\n| Bạch đầu ông        | 30g |             |     |\n* *Sắc uống.**           \n| *Đảng sâm          | 30g | Chỉ xác     | 30g |\n| Ô mai              | 30g | Côn bố      | 30g |\n| Mạch môn           | 30g | Ngũ vị tử   | 30g |\n| Quất hạch          | 30g | Lệ chi hạch | 30g |\n| Hải tảo            | 30g | Hạ khô tháo | 30g |\n| Đơn sâm            | 90g | Quy bản     | 60g |\n| Bạch đầu ông       | 60g |             |     |\n|                     |     |             |     |\n\n* *Tất cả tán bột làm hoán nặng 10g. Uống sáng, trưa, tối mỗi lần 1 hoàn.**', '# **1. CÔN BỐ**\n\n* Tên khác.* **Hải côn bố, Hải đới, Nga chưởng thái.**\n\n* Tên khoa học.* **Laminaria japonica Aresch (Hải đới)**\n\n* Mô tả.* **Côn bố Laminaria japonica là loại tảo sống nhiều năm, thân dẹt, có màu nâu, có móc để bám vào đá, thân hình trụ, lá dẹt, mép có răng cưa nhỏ.**\n\n![](![id: cay-thuoc-vi-thuoc-phong-chua-benh-noi-tiet_img_012](cay-thuoc-vi-thuoc-phong-chua-benh-noi-tiet_img_012.png))\n\n* Hỉnh 8. Côn bố*\n* Tính năng công dụng và liều dùng.* **Côn bố vị mặn, tính hàn, có tác dụng nhuyễn kiên tán kết, hóa đờm tiêu tích. Do đờm khí kết tụ mà sinh tràng nhạc, hạch (bao gồm hạch limpo, sưng tuyến giáp trạng) có thể dùng côn bố phối với nguyên sâm, Sinh mẫu lệ, hạ khô thảo, bối mẫu, hoàng cầm, xích thược, hồng hoa, bách bộ, hải tảo...**\n\n* *Trong bụng do có đờm thực, huyết ứ tích lâu ngày thành cục mà sinh phỉ, tệ, mảng aíng (bao gồm sưng gan, lá lách, nang, sưng trong bụng, khối u...) có thể dùng côn bố với mai ba ba nướng, Sinh mẫu lệ, sinh hương phụ, thảo hồng hoa, cứu sơn giác, tiêu thần khúc, sơn tra hạch (hạt), đương quy, đào nhân, tam lăng, nga truật... để tiêu tán tích khối.**\n\n* *Nghiên cứu gần đây cho biết: côn bố có thể dùng vào chữa cường tuyến giáp trạng và sưng tuyến giáp trạng do thiếu iốt.**\n* *Hải tảo và côn bố có tác dụng gần giống nhau, tuy dược lực của hải tảo tương đối hòa hoãn, côn bố thì mạnh hơn mà lại hoạt lợi. Đối với loại hải tảo, côn bố, người thời xưa ăn nhiều chỉ có tác dụng giảm béo. Dùng chữa cho người béo, xơ vữa động mạch, huyết áp cao, có hiệu quả nhất định. Lượng dùng thường là 8 - 12g.**\n\n* Chú ý.* **Người tỳ vị hư hàn và hàn đờm tích tụ thì không nên dùng.**']","Theo y học cổ truyền, Hải tảo có tác dụng làm mềm chất cứng (nhuyễn kiên) và tiêu đàm, lợi thủy. Đặc biệt, Hải tảo được sử dụng để điều trị các tình trạng liên quan đến thủy dịch như ung thư tuyến giáp trạng, viêm phế quản mãn tính, bệnh mạch vành, tích tụ, lao hạch lâm ba, thủy thũng, cước khí, sưng cao hoàn.",Lợi thủy.,1,0.245552,1.0,0.977730732
Actisô thuộc họ thực vật nào?,"['#### 1) ACTISÔ\n\nActisô-Cynara scolymus L. thuộc họ Cúc Asteraceae hay Compositae. Cây thảo cao khoảng lm, có lá mọc so le chia thành nhiều thuỳ, mặt trên màu lục, mặt dưới màu trắng nhạt vì có nhiều lông nhung. Cụm hoa mà người ta quen gọi là bông Actisô nằm ở đầu các nhánh của thân, có đường kính 6-15cm, phía ngoài có những lá bắc có đỉnh nhọn, tiếp đó là những hoa bao bởi những lông tơ nằm trên một đế hoa nạc. Màu sắc của cụm hoa khác nhau tùy theo thứ (hiện đã biết đến hàng chục thứ).\n\n![](![id: cay-rau-lam-thuoc_img_004](cay-rau-lam-thuoc_img_004.png))\nCây Actisô có nguồn gốc ở vùng Địa trung hải. Người Ai cập đã biết trồng cây này từ lâu, nhưng chính nhờ người Ả rập đem vào Tây ban nha trước tiên rồi đến Ý (vào thế kỷ 15) từ đó lan sang Pháp và Anh (vào thế kỷ 16) mới biết dùng nó. Ở nước ta, Actisô được người Pháp đem vào trồng ở những vùng núi cao mát mẻ như Đà lạt, Sapa, Tam đảo, tên gọi của cây này là từ tiếng Pháp Artichant. Hiện nay, Actisô được trồng rộng rãi ở Đà lạt với khối lượng lớn. Một số nơi vùng đồng bằng Bắc bộ (huyện Tứ lộc, tỉnh Hải hưng) và Trung bộ (huyện Quỳnh lưu, tỉnh Nghệ an) cũng có trồng.\n\nNgười ta thường trồng Actisô bằng cây con tách từ cây mẹ, sau khi đã thu hoạch cây mẹ. Nay ta cũng nhập một số hạt giống mới và gieo hạt lấy cây con.\n\nActisô được sử dụng dưới nhiều dạng, dùng tươi, dùng khô, nấu cao, chế dược phẩm v.v... Ở chợ Đà lạt, người ta bán bông Actisô tươi, bông chẻ nhỏ phơi khô, lá khô, thân và rễ phơi khô.\nCây Actisô còn non có thể dùng luộc chín hay nấu canh ăn, nhưng bộ phận thường được sử dụng làm rau ăn là cụm hoa (bông Actisô) bao gồm đế hoa mang hoa, các lông tơ và các lá bắc (có phần gốc mềm màu trắng) bao xung quanh. Người ta mang về, chẻ nhỏ ra theo chiều dọc thành 6–8 miếng rồi đem hầm xương, hầm với thịt lợn, thịt bò để ăn cả cái và nước.\n\nNgười ta đã biết thành phần hoá học của cụm hoa Actisô. Có đến 3 tới 3,15% protein, 0,10 đến 0,30% lipid, 11 đến 15,50% glucid (gồm chủ yếu là inulase, dùng tốt cho người bị bệnh đái đường), 82% nước. Ngoài ra còn có mangan, photpho, sắt, 300 UI vitamin A, 120 gama vitamin B1, 30 gama vitamin B2, 10mg vitamin C. 100 gam Actisô cung cấp khoảng 50–75 calo.\nBông Actisô là loại rau cao cấp, khi nấu chín rất dễ tiêu hoá, tạo ra năng lượng, kích thích giúp ăn ngon miệng, bổ gan, bổ tim, lọc máu, chống độc, lợi tiểu (làm tăng sự bài tiết urê, cholesterol dư thừa và acid uric), giúp sự tiết sữa cho các bà mẹ nuôi con. Do đó mà bông Actisô được chỉ định dùng trong trường hợp suy nhược, lao lực, trong sự sinh trưởng, trong sung huyết và thiểu năng gan, thiểu năng thận, giảm niệu, bệnh sỏi, trong thấp khớp, thống phong, tạng khớp, trong trường hợp bị nhiễm độc và trong sự nhiễm khuẩn đường ruột.\nNước sắc Actisô rất giàu muối khoáng, có thể dùng trong ăn uống. Cũng cần chú ý là các cây Actisô non nấu chín ăn được dùng trong bệnh ỉa chảy mạn tính; rễ cây có tác dụng lợi tiểu được dùng trong trường hợp thấp khớp, thống phong, thuỷ thũng và cả trường hợp vàng da. Lá Actisô là bộ phận quan trọng của cây được sử dụng làm thuốc dưới dạng bột, nấu cao, chiết hoạt chất. Ở nước ta cũng đã sản xuất nhiều mặt hàng dược phẩm như cao Actisô, trà Actisô, Cynaraphytol viên, thuốc giọt Cynaraphytol, thuốc nước đóng ống Actisamin... có nhiều công dụng về mặt tuần hoàn và máu, gan và thận.\nActisô đã được xem là cây thuốc rất quý đối với các rối loạn có nguồn gốc gan (vàng da, sỏi mật, nhiễm độc ruột...), trong các rối loạn mà sự thải nước tiểu khó khăn (các bệnh nhiễm trùng, nhiễm độc), trong các bệnh có nguồn gốc gan, một số bệnh ngoài da và các trạng thái quá thừa. Công dụng của nó đã trở thành kinh điển trong các chứng rối loạn của lứa tuổi 50, tạng khớp, thừa nito-huyết... Bông Actisô là một loại rau vừa bổ, vừa ngon; chất đường trong đó dùng tốt cho những người bị bệnh đái đường. Nhưng cần chú ý là khi dùng, phải rửa sạch bằng nước sạch nhiều lần để sát trùng và khử độc do phun thuốc trừ sâu hoặc do các nguyên nhân khác.', '## 154 XƯƠNG SÔNG\nXương sông hay Rau húng ăn gỏi – Blumea myriocephala DC. = Blumea lanceolaria (Roxb.) Druce, thuộc họ Cúc – Asteraceae. Cây thảo sống dai, cao khoảng 1m hay hơn. Lá hình ngọn giáo, gốc thuôn dài, chóp nhọn, mép có răng của. Cụm hoa hình đầu, màu vàng nhạt hợp thành chuỳ dài ở ngọn.\n\nXương sông là cây mọc hoang dại và được trồng ở khắp nơi lấy lá làm gia vị, ăn gỏi cá, gỏi thịt, để nướng chả và làm rau ăn chống dị ứng đối với thức ăn tanh như lươn, ốc cá. Ngâm lá cây trong muối vài ngày dùng làm gia vị. Xương sông thường đi kèm Rau ngót trong món canh cá. Cũng dùng nấu canh thịt.\n\nXương sông có vị cay thơm, tính ấm, có tác dụng trừ tanh hôi, giúp tiêu hoá, tiêu đàm thấp, chữa họ cảm, viêm họng, tưa mồm, trắng lưỡi, chữa tịt mũi, huyết ủng đau đầu, đầy bụng đi ngoài và chứng co giật trẻ em.\nThường dùng với lá Họ, Hồng bạch, hoa Đu đủ đực để chữa ho trẻ em, hoặc dùng Xương sông. Chua me đất giá nhỏ chế nước nóng vào, vắt lấy nước cốt cho uống. Phối hợp với Tía tô, Hành, Hương phụ để chữa cảm. Lá Xương sông cũng dùng giã nát, đắp cầm máu, và dùng đắp trị sưng vú, nứt vú.\n\nĐể chữa chứng phong hàn, cấm khẩu, dùng lá Xương sông, lá Xương bồ giã tươi hoà với nước nóng cho uống, hoặc sắc nước uống.\n\n![](![id: cay-rau-lam-thuoc_img_166](cay-rau-lam-thuoc_img_166.png))', '## 45 ĐIỀU\n\nĐiều hay Đào lộn hột – Anacardium occidentale L., thuộc họ Đào lộn hột – Anacardiaceae. Cây gỗ lớn cao tới 10m hay hơn, có lá mọc so le, hình trứng ngược. Cụm hoa mang nhiều màu hoa vàng nhạt, điểm thêm màu đỏ. Quả dạng quả hạch, hình thận, cứng, nằm phía trên một cuống quả phình to hình quả lê màu đỏ, hồng hay vàng. Ta thường gọi nhằm quả điều thật là hạt và cuống quả điều là trái (vì nó có dạng quả cây).\nCây điều gốc ở Đông bắc Brazil nhưng khả năng thích nghi rất lớn cho nên sau khi đã trồng ở nhiều vùng nhiệt đới khác, Điều đã trở thành một cây mọc hoang dại, do vậy có người lầm tưởng Môdămbích, Ấn độ cũng là vùng nguyên sản của nó. Các nước này cũng là những nước sản xuất nhiều hạt Điều.\n\nĐiều được trồng ở nước ta khoảng 200 năm. Những nơi trồng nhiều là Quảng nam-Đà nẵng, Bình định, Đồng nai, Tây ninh, An giang, Kiên giang, Gia lai, Kontum, Đaklak. Do nhu cầu về hạt Điều để xuất khẩu nhiều, việc trồng\n\n![](![id: cay-rau-lam-thuoc_img_050](cay-rau-lam-thuoc_img_050.png))\n\nĐiều đang được mở rộng ở nhiều địa phương, diện tích trồng Điều trong cả nước hiện có khoảng 50.000 hecta.\n\nĐiều cho sản phẩm chính là hạt và đầu vỏ điều. Hạt điều, về phương diện thực vật học, phải gọi là quả, loại quả hạch có lớp vỏ cứng mà nhân bên trong mới thực là hạt. Người ta dùng nhân Điều để chế biến\nthực phẩm như kẹo hạt điều, bơ hạt điều rang muối, hạt điều da cá... Còn dầu vỏ hạt điều là loại dung dịch được trích ly từ vỏ quả điều (hạt) chứa 90% acid anacardic, 10% cardol.\n\nBộ phận mà người ta thường sử dụng làm rau chính là cuống quả phình to ra mà thành, khi chín có màu từ vàng tới đỏ, mà ta hay gọi nhằm là quả. Cuống quả điều có mùi thơm dễ chịu có ngọt có chua có thể dùng để ăn sống (như một loại rau), nấu canh chua, làm nguyên liệu cho công nghiệp đồ uống (nước quả ép để giải khát, mứt quả, rượu, giấm). Thành phần chủ yếu của nó là nước, có một ít đường và khá nhiều vitamin C (gấp 5 lần trong cám). Thường khi người ta chờ cho hạt chín mới thu hoạch thì cuống quả Điều đã chín quá, nên tỷ lệ thu hồi loại sản phẩm này thấp. Do đó, người ta thường chỉ dùng để ăn ngay hoặc bỏ đi. Cũng cần chú ý là ngọn non cây điều có thể dùng ăn ghém với bánh xèo, như lá xoài non và lá thành ngạnh.\nCuống quả điều là thuốc chữa ỉa chảy thường được dùng. Từ lâu đời, nhân dân châu Phi ở những vùng có cây Điều đã thu nhặt quả chín (cuống quả) dùng một số lượng lớn rải quanh các hồ chứa nước (nơi mà loài muỗi anophen phát triển với mức độ khủng khiếp) để diệt muỗi. Khi DDT còn được dùng phổ biến, ít ai để ý đến phương pháp diệt muỗi thô sơ này. Nhưng từ lúc phát hiện tính chất nguy hiểm của DDT đối với môi trường, các nhà khoa học đã chú ý tới quả điều. Các công trình nghiên cứu cho thấy quả điều có chất acid ngăn cản một loại quá trình sinh lý của ấu trùng muỗi làm cho chúng bị diệt nhưng không làm hại đến người và môi trường.']",Actisô (Cynara scolymus L.) thuộc họ Cúc Asteraceae hay Compositae.,Họ Cúc (Asteraceae/Compositae).,1,0.935746238,1.0,0.834655169
"Trong cụm hoa Actisô, glucid chủ yếu là chất gì?","['#### 1) ACTISÔ\n\nActisô-Cynara scolymus L. thuộc họ Cúc Asteraceae hay Compositae. Cây thảo cao khoảng lm, có lá mọc so le chia thành nhiều thuỳ, mặt trên màu lục, mặt dưới màu trắng nhạt vì có nhiều lông nhung. Cụm hoa mà người ta quen gọi là bông Actisô nằm ở đầu các nhánh của thân, có đường kính 6-15cm, phía ngoài có những lá bắc có đỉnh nhọn, tiếp đó là những hoa bao bởi những lông tơ nằm trên một đế hoa nạc. Màu sắc của cụm hoa khác nhau tùy theo thứ (hiện đã biết đến hàng chục thứ).\n\n![](![id: cay-rau-lam-thuoc_img_004](cay-rau-lam-thuoc_img_004.png))\nCây Actisô có nguồn gốc ở vùng Địa trung hải. Người Ai cập đã biết trồng cây này từ lâu, nhưng chính nhờ người Ả rập đem vào Tây ban nha trước tiên rồi đến Ý (vào thế kỷ 15) từ đó lan sang Pháp và Anh (vào thế kỷ 16) mới biết dùng nó. Ở nước ta, Actisô được người Pháp đem vào trồng ở những vùng núi cao mát mẻ như Đà lạt, Sapa, Tam đảo, tên gọi của cây này là từ tiếng Pháp Artichant. Hiện nay, Actisô được trồng rộng rãi ở Đà lạt với khối lượng lớn. Một số nơi vùng đồng bằng Bắc bộ (huyện Tứ lộc, tỉnh Hải hưng) và Trung bộ (huyện Quỳnh lưu, tỉnh Nghệ an) cũng có trồng.\n\nNgười ta thường trồng Actisô bằng cây con tách từ cây mẹ, sau khi đã thu hoạch cây mẹ. Nay ta cũng nhập một số hạt giống mới và gieo hạt lấy cây con.\n\nActisô được sử dụng dưới nhiều dạng, dùng tươi, dùng khô, nấu cao, chế dược phẩm v.v... Ở chợ Đà lạt, người ta bán bông Actisô tươi, bông chẻ nhỏ phơi khô, lá khô, thân và rễ phơi khô.\nCây Actisô còn non có thể dùng luộc chín hay nấu canh ăn, nhưng bộ phận thường được sử dụng làm rau ăn là cụm hoa (bông Actisô) bao gồm đế hoa mang hoa, các lông tơ và các lá bắc (có phần gốc mềm màu trắng) bao xung quanh. Người ta mang về, chẻ nhỏ ra theo chiều dọc thành 6–8 miếng rồi đem hầm xương, hầm với thịt lợn, thịt bò để ăn cả cái và nước.\n\nNgười ta đã biết thành phần hoá học của cụm hoa Actisô. Có đến 3 tới 3,15% protein, 0,10 đến 0,30% lipid, 11 đến 15,50% glucid (gồm chủ yếu là inulase, dùng tốt cho người bị bệnh đái đường), 82% nước. Ngoài ra còn có mangan, photpho, sắt, 300 UI vitamin A, 120 gama vitamin B1, 30 gama vitamin B2, 10mg vitamin C. 100 gam Actisô cung cấp khoảng 50–75 calo.\nBông Actisô là loại rau cao cấp, khi nấu chín rất dễ tiêu hoá, tạo ra năng lượng, kích thích giúp ăn ngon miệng, bổ gan, bổ tim, lọc máu, chống độc, lợi tiểu (làm tăng sự bài tiết urê, cholesterol dư thừa và acid uric), giúp sự tiết sữa cho các bà mẹ nuôi con. Do đó mà bông Actisô được chỉ định dùng trong trường hợp suy nhược, lao lực, trong sự sinh trưởng, trong sung huyết và thiểu năng gan, thiểu năng thận, giảm niệu, bệnh sỏi, trong thấp khớp, thống phong, tạng khớp, trong trường hợp bị nhiễm độc và trong sự nhiễm khuẩn đường ruột.\nNước sắc Actisô rất giàu muối khoáng, có thể dùng trong ăn uống. Cũng cần chú ý là các cây Actisô non nấu chín ăn được dùng trong bệnh ỉa chảy mạn tính; rễ cây có tác dụng lợi tiểu được dùng trong trường hợp thấp khớp, thống phong, thuỷ thũng và cả trường hợp vàng da. Lá Actisô là bộ phận quan trọng của cây được sử dụng làm thuốc dưới dạng bột, nấu cao, chiết hoạt chất. Ở nước ta cũng đã sản xuất nhiều mặt hàng dược phẩm như cao Actisô, trà Actisô, Cynaraphytol viên, thuốc giọt Cynaraphytol, thuốc nước đóng ống Actisamin... có nhiều công dụng về mặt tuần hoàn và máu, gan và thận.\nActisô đã được xem là cây thuốc rất quý đối với các rối loạn có nguồn gốc gan (vàng da, sỏi mật, nhiễm độc ruột...), trong các rối loạn mà sự thải nước tiểu khó khăn (các bệnh nhiễm trùng, nhiễm độc), trong các bệnh có nguồn gốc gan, một số bệnh ngoài da và các trạng thái quá thừa. Công dụng của nó đã trở thành kinh điển trong các chứng rối loạn của lứa tuổi 50, tạng khớp, thừa nito-huyết... Bông Actisô là một loại rau vừa bổ, vừa ngon; chất đường trong đó dùng tốt cho những người bị bệnh đái đường. Nhưng cần chú ý là khi dùng, phải rửa sạch bằng nước sạch nhiều lần để sát trùng và khử độc do phun thuốc trừ sâu hoặc do các nguyên nhân khác.', '## Page 343\n\nStephania rotunda Lour, S. pierrei Diels, S.brachchyandra Diels, S.cambodiânn\nGagnep, S. cepharamtha hay S, dielsiara Y.C.Wu\n\nRotundin là alcaloide chính được chiết xuất từ củ bình vôi thuộc chi Stephania họ\nTiết dê. Các loại bình vôi có đặc điểm chung là lọai dây leo, thân nhẵn màu xanh,\ngốc hoá gỗ, sống lâu năm. Rễ phình to thành củ rất đa dạng, củ có thể nặng đến\n40 kg, vỏ ngoài xù xì. màu nâu hoặc đen, hình dáng thay đổi tùy theo nơi củ phát\ntriển. lá mọc so le, cuống lá dài, dính vào phiến lá khoảng 1/3, phiến lá hình tim\nhoặc gần như tròn, mép lá nguyên hoặc hơi lượn sóng, hai mặt nhẵn, gân lá xuất\nphát từ chỗ dính của cuống lá, nổi rõ ở mặt dưới lá. Cụm hoa hình xim tán mọc ở\nkẽ lá hoặc ở những cành già đã rụng lá; hoa đực và hoa cái khác gốc; hoa đực có 6\nlá dài xếp thành hai vòng, 3 cánh hoa màu vàng cam. Bộ nhị hàn liền thành một\ncục với 6 bao phấn màu vàng nhạt xếp thành vòng tròn. Khi hoa nở các bao phấn\nmở nắp ngang quay ra xung quanh. Hạt phấn nhỏ màu vàng, hoa cái có một lá dài,\nhai cánh hoa bầu hình trứng. Quả hạch hình cầu hơi dẹt, khi chín có màu đỏ hoặc\nda cam, hạt cứng hình móng ngựa, hình trứng hoặc hình gần tròn tùy theo loài.\nMùa hoa vào tháng 2 đến tháng 6, mùa quả vào tháng 7 đến tháng 10.\n\nBộ phận dùng là củ có alcaloide chính là L- tetrahydropalmatin (0,2-0,355%). Hàm\nlượng alcaloide toàn phần cũng như Levo- tetrahydropalmatin thay đổi tùy theo\ntừng loài và từng vùng thu hái. Hàm lượng L- tetrahydropalmatin đạt tới 3,55% ở\nloài S. brahyandra thu ở Hoàng Liên Sơn; 1,31% ở loài S sinica Diels (thu ở Hà Nam)\nNinh); 1,30% ở loài S Kwangsiensis thu ở Quảng Ninh; 0,72% ở loài S. hainanensis\nthu ở Thanh Hoá; 0,62% ở loài S.cambodiana Gagnep (thu ở Lâm Đồng); 0,29% ở\nloài S.cepharantha thu ở Hà Sơn Bình; 0,21% ở loài S. peirrel Diels thu ở Tây\nNguyên.\n\nChiết xuất rotundin: chiết xuất thô từ củ tươi: sát nhỏ củ bình vôi đã gọt vỏ hoặc\ngiã nhỏ, gói vào gạc rồi đêm ép lấy nước, thêm nước vào bã cho xâm xấp rồi lại\nép. Làm như vậy 3 đến 4 lần cho đến khi nước ép hết vị đắng hoặc không cho tủa\nvới thuốc thử Mayer thì thôi. Tập trung nước ép lại, nếu còn bã thì lọc qua bông\ncho trong. Dùng nước vôi trong để kiềm hoá đến pH 9-10, routndin thô sẽ tủa\nxuống, gạn bỏ nước trong ở trên. lọc lấy tủa, rửa lại tủa bằng nước máy. Lấy tủa\nđem hong gió rồi sấy nhẹ đến thật khô.\n\n\n\n</break>', '## 45 ĐIỀU\n\nĐiều hay Đào lộn hột – Anacardium occidentale L., thuộc họ Đào lộn hột – Anacardiaceae. Cây gỗ lớn cao tới 10m hay hơn, có lá mọc so le, hình trứng ngược. Cụm hoa mang nhiều màu hoa vàng nhạt, điểm thêm màu đỏ. Quả dạng quả hạch, hình thận, cứng, nằm phía trên một cuống quả phình to hình quả lê màu đỏ, hồng hay vàng. Ta thường gọi nhằm quả điều thật là hạt và cuống quả điều là trái (vì nó có dạng quả cây).\nCây điều gốc ở Đông bắc Brazil nhưng khả năng thích nghi rất lớn cho nên sau khi đã trồng ở nhiều vùng nhiệt đới khác, Điều đã trở thành một cây mọc hoang dại, do vậy có người lầm tưởng Môdămbích, Ấn độ cũng là vùng nguyên sản của nó. Các nước này cũng là những nước sản xuất nhiều hạt Điều.\n\nĐiều được trồng ở nước ta khoảng 200 năm. Những nơi trồng nhiều là Quảng nam-Đà nẵng, Bình định, Đồng nai, Tây ninh, An giang, Kiên giang, Gia lai, Kontum, Đaklak. Do nhu cầu về hạt Điều để xuất khẩu nhiều, việc trồng\n\n![](![id: cay-rau-lam-thuoc_img_050](cay-rau-lam-thuoc_img_050.png))\n\nĐiều đang được mở rộng ở nhiều địa phương, diện tích trồng Điều trong cả nước hiện có khoảng 50.000 hecta.\n\nĐiều cho sản phẩm chính là hạt và đầu vỏ điều. Hạt điều, về phương diện thực vật học, phải gọi là quả, loại quả hạch có lớp vỏ cứng mà nhân bên trong mới thực là hạt. Người ta dùng nhân Điều để chế biến\nthực phẩm như kẹo hạt điều, bơ hạt điều rang muối, hạt điều da cá... Còn dầu vỏ hạt điều là loại dung dịch được trích ly từ vỏ quả điều (hạt) chứa 90% acid anacardic, 10% cardol.\n\nBộ phận mà người ta thường sử dụng làm rau chính là cuống quả phình to ra mà thành, khi chín có màu từ vàng tới đỏ, mà ta hay gọi nhằm là quả. Cuống quả điều có mùi thơm dễ chịu có ngọt có chua có thể dùng để ăn sống (như một loại rau), nấu canh chua, làm nguyên liệu cho công nghiệp đồ uống (nước quả ép để giải khát, mứt quả, rượu, giấm). Thành phần chủ yếu của nó là nước, có một ít đường và khá nhiều vitamin C (gấp 5 lần trong cám). Thường khi người ta chờ cho hạt chín mới thu hoạch thì cuống quả Điều đã chín quá, nên tỷ lệ thu hồi loại sản phẩm này thấp. Do đó, người ta thường chỉ dùng để ăn ngay hoặc bỏ đi. Cũng cần chú ý là ngọn non cây điều có thể dùng ăn ghém với bánh xèo, như lá xoài non và lá thành ngạnh.\nCuống quả điều là thuốc chữa ỉa chảy thường được dùng. Từ lâu đời, nhân dân châu Phi ở những vùng có cây Điều đã thu nhặt quả chín (cuống quả) dùng một số lượng lớn rải quanh các hồ chứa nước (nơi mà loài muỗi anophen phát triển với mức độ khủng khiếp) để diệt muỗi. Khi DDT còn được dùng phổ biến, ít ai để ý đến phương pháp diệt muỗi thô sơ này. Nhưng từ lúc phát hiện tính chất nguy hiểm của DDT đối với môi trường, các nhà khoa học đã chú ý tới quả điều. Các công trình nghiên cứu cho thấy quả điều có chất acid ngăn cản một loại quá trình sinh lý của ấu trùng muỗi làm cho chúng bị diệt nhưng không làm hại đến người và môi trường.']","Trong cụm hoa Actisô, glucid chủ yếu là inulase.",Glucid chủ yếu là inulase.,1,0.945721533,1.0,0.836906685
Cụm hoa Actisô có những nhóm chất nào?,"['#### 1) ACTISÔ\n\nActisô-Cynara scolymus L. thuộc họ Cúc Asteraceae hay Compositae. Cây thảo cao khoảng lm, có lá mọc so le chia thành nhiều thuỳ, mặt trên màu lục, mặt dưới màu trắng nhạt vì có nhiều lông nhung. Cụm hoa mà người ta quen gọi là bông Actisô nằm ở đầu các nhánh của thân, có đường kính 6-15cm, phía ngoài có những lá bắc có đỉnh nhọn, tiếp đó là những hoa bao bởi những lông tơ nằm trên một đế hoa nạc. Màu sắc của cụm hoa khác nhau tùy theo thứ (hiện đã biết đến hàng chục thứ).\n\n![](![id: cay-rau-lam-thuoc_img_004](cay-rau-lam-thuoc_img_004.png))\nCây Actisô có nguồn gốc ở vùng Địa trung hải. Người Ai cập đã biết trồng cây này từ lâu, nhưng chính nhờ người Ả rập đem vào Tây ban nha trước tiên rồi đến Ý (vào thế kỷ 15) từ đó lan sang Pháp và Anh (vào thế kỷ 16) mới biết dùng nó. Ở nước ta, Actisô được người Pháp đem vào trồng ở những vùng núi cao mát mẻ như Đà lạt, Sapa, Tam đảo, tên gọi của cây này là từ tiếng Pháp Artichant. Hiện nay, Actisô được trồng rộng rãi ở Đà lạt với khối lượng lớn. Một số nơi vùng đồng bằng Bắc bộ (huyện Tứ lộc, tỉnh Hải hưng) và Trung bộ (huyện Quỳnh lưu, tỉnh Nghệ an) cũng có trồng.\n\nNgười ta thường trồng Actisô bằng cây con tách từ cây mẹ, sau khi đã thu hoạch cây mẹ. Nay ta cũng nhập một số hạt giống mới và gieo hạt lấy cây con.\n\nActisô được sử dụng dưới nhiều dạng, dùng tươi, dùng khô, nấu cao, chế dược phẩm v.v... Ở chợ Đà lạt, người ta bán bông Actisô tươi, bông chẻ nhỏ phơi khô, lá khô, thân và rễ phơi khô.\nCây Actisô còn non có thể dùng luộc chín hay nấu canh ăn, nhưng bộ phận thường được sử dụng làm rau ăn là cụm hoa (bông Actisô) bao gồm đế hoa mang hoa, các lông tơ và các lá bắc (có phần gốc mềm màu trắng) bao xung quanh. Người ta mang về, chẻ nhỏ ra theo chiều dọc thành 6–8 miếng rồi đem hầm xương, hầm với thịt lợn, thịt bò để ăn cả cái và nước.\n\nNgười ta đã biết thành phần hoá học của cụm hoa Actisô. Có đến 3 tới 3,15% protein, 0,10 đến 0,30% lipid, 11 đến 15,50% glucid (gồm chủ yếu là inulase, dùng tốt cho người bị bệnh đái đường), 82% nước. Ngoài ra còn có mangan, photpho, sắt, 300 UI vitamin A, 120 gama vitamin B1, 30 gama vitamin B2, 10mg vitamin C. 100 gam Actisô cung cấp khoảng 50–75 calo.\nBông Actisô là loại rau cao cấp, khi nấu chín rất dễ tiêu hoá, tạo ra năng lượng, kích thích giúp ăn ngon miệng, bổ gan, bổ tim, lọc máu, chống độc, lợi tiểu (làm tăng sự bài tiết urê, cholesterol dư thừa và acid uric), giúp sự tiết sữa cho các bà mẹ nuôi con. Do đó mà bông Actisô được chỉ định dùng trong trường hợp suy nhược, lao lực, trong sự sinh trưởng, trong sung huyết và thiểu năng gan, thiểu năng thận, giảm niệu, bệnh sỏi, trong thấp khớp, thống phong, tạng khớp, trong trường hợp bị nhiễm độc và trong sự nhiễm khuẩn đường ruột.\nNước sắc Actisô rất giàu muối khoáng, có thể dùng trong ăn uống. Cũng cần chú ý là các cây Actisô non nấu chín ăn được dùng trong bệnh ỉa chảy mạn tính; rễ cây có tác dụng lợi tiểu được dùng trong trường hợp thấp khớp, thống phong, thuỷ thũng và cả trường hợp vàng da. Lá Actisô là bộ phận quan trọng của cây được sử dụng làm thuốc dưới dạng bột, nấu cao, chiết hoạt chất. Ở nước ta cũng đã sản xuất nhiều mặt hàng dược phẩm như cao Actisô, trà Actisô, Cynaraphytol viên, thuốc giọt Cynaraphytol, thuốc nước đóng ống Actisamin... có nhiều công dụng về mặt tuần hoàn và máu, gan và thận.\nActisô đã được xem là cây thuốc rất quý đối với các rối loạn có nguồn gốc gan (vàng da, sỏi mật, nhiễm độc ruột...), trong các rối loạn mà sự thải nước tiểu khó khăn (các bệnh nhiễm trùng, nhiễm độc), trong các bệnh có nguồn gốc gan, một số bệnh ngoài da và các trạng thái quá thừa. Công dụng của nó đã trở thành kinh điển trong các chứng rối loạn của lứa tuổi 50, tạng khớp, thừa nito-huyết... Bông Actisô là một loại rau vừa bổ, vừa ngon; chất đường trong đó dùng tốt cho những người bị bệnh đái đường. Nhưng cần chú ý là khi dùng, phải rửa sạch bằng nước sạch nhiều lần để sát trùng và khử độc do phun thuốc trừ sâu hoặc do các nguyên nhân khác.', '## Page 80\n\nIsobucaine(Kincaine).\n\nEster của acid para amino benzoic:\n\nNovocaine(procaine).\n\nTetracaine(pontocaine).\n\nNonocaine(butethemine).\n\nRavocaine(propoxycaine).\n\nNesacaine(2 chloroprocaine).\n\nEster của acid meta amino benzoic:\n\nUnacaine(Metabutathamine).\n\nPrimacaine.\n\nEster của acid ethoxy benzoic:\n\nIntracaine(diethoxyne).\n\nNhóm linh tinh:\n\nNhóm Quinolinel:\n\nDibucaine(Nupercaine)\n\nPercaine.\n\nNhóm amid:\n\nXylocaine(Lidocaine, lignocaine).\n\nMepivacaine(carbocaine).\n\nPrilocaine(Dyncaine).\n\nBupivacaine(Marcaine).\n\nNhóm Cylaine.\n\n\n\n</break>', '## Page 343\n\nStephania rotunda Lour, S. pierrei Diels, S.brachchyandra Diels, S.cambodiânn\nGagnep, S. cepharamtha hay S, dielsiara Y.C.Wu\n\nRotundin là alcaloide chính được chiết xuất từ củ bình vôi thuộc chi Stephania họ\nTiết dê. Các loại bình vôi có đặc điểm chung là lọai dây leo, thân nhẵn màu xanh,\ngốc hoá gỗ, sống lâu năm. Rễ phình to thành củ rất đa dạng, củ có thể nặng đến\n40 kg, vỏ ngoài xù xì. màu nâu hoặc đen, hình dáng thay đổi tùy theo nơi củ phát\ntriển. lá mọc so le, cuống lá dài, dính vào phiến lá khoảng 1/3, phiến lá hình tim\nhoặc gần như tròn, mép lá nguyên hoặc hơi lượn sóng, hai mặt nhẵn, gân lá xuất\nphát từ chỗ dính của cuống lá, nổi rõ ở mặt dưới lá. Cụm hoa hình xim tán mọc ở\nkẽ lá hoặc ở những cành già đã rụng lá; hoa đực và hoa cái khác gốc; hoa đực có 6\nlá dài xếp thành hai vòng, 3 cánh hoa màu vàng cam. Bộ nhị hàn liền thành một\ncục với 6 bao phấn màu vàng nhạt xếp thành vòng tròn. Khi hoa nở các bao phấn\nmở nắp ngang quay ra xung quanh. Hạt phấn nhỏ màu vàng, hoa cái có một lá dài,\nhai cánh hoa bầu hình trứng. Quả hạch hình cầu hơi dẹt, khi chín có màu đỏ hoặc\nda cam, hạt cứng hình móng ngựa, hình trứng hoặc hình gần tròn tùy theo loài.\nMùa hoa vào tháng 2 đến tháng 6, mùa quả vào tháng 7 đến tháng 10.\n\nBộ phận dùng là củ có alcaloide chính là L- tetrahydropalmatin (0,2-0,355%). Hàm\nlượng alcaloide toàn phần cũng như Levo- tetrahydropalmatin thay đổi tùy theo\ntừng loài và từng vùng thu hái. Hàm lượng L- tetrahydropalmatin đạt tới 3,55% ở\nloài S. brahyandra thu ở Hoàng Liên Sơn; 1,31% ở loài S sinica Diels (thu ở Hà Nam)\nNinh); 1,30% ở loài S Kwangsiensis thu ở Quảng Ninh; 0,72% ở loài S. hainanensis\nthu ở Thanh Hoá; 0,62% ở loài S.cambodiana Gagnep (thu ở Lâm Đồng); 0,29% ở\nloài S.cepharantha thu ở Hà Sơn Bình; 0,21% ở loài S. peirrel Diels thu ở Tây\nNguyên.\n\nChiết xuất rotundin: chiết xuất thô từ củ tươi: sát nhỏ củ bình vôi đã gọt vỏ hoặc\ngiã nhỏ, gói vào gạc rồi đêm ép lấy nước, thêm nước vào bã cho xâm xấp rồi lại\nép. Làm như vậy 3 đến 4 lần cho đến khi nước ép hết vị đắng hoặc không cho tủa\nvới thuốc thử Mayer thì thôi. Tập trung nước ép lại, nếu còn bã thì lọc qua bông\ncho trong. Dùng nước vôi trong để kiềm hoá đến pH 9-10, routndin thô sẽ tủa\nxuống, gạn bỏ nước trong ở trên. lọc lấy tủa, rửa lại tủa bằng nước máy. Lấy tủa\nđem hong gió rồi sấy nhẹ đến thật khô.\n\n\n\n</break>']","Cụm hoa Actisô chứa nhiều nhóm chất khác nhau, bao gồm protein, lipid, glucid, nước, cùng các vi chất như mangan, photpho, sắt, vitamin A, vitamin B1, vitamin B2, và vitamin C. Glucid trong cụm hoa Actisô chủ yếu là inulase, có lợi cho người bị bệnh đái đường. Ngoài ra, cụm hoa Actisô còn chứa calo và có tác dụng trong việc tạo năng lượng, kích thích ăn ngon miệng, bổ gan, bổ tim, lọc máu, chống độc, lợi tiểu, giúp sự tiết sữa, và hỗ trợ trong nhiều tình trạng sức khỏe khác như suy nhược, lao lực, trong sự sinh trưởng, trong sung huyết và thiểu năng gan, thiểu năng thận, giảm niệu, bệnh sỏi, trong thấp khớp, thống phong, tạng khớp, trong trường hợp bị nhiễm độc và trong sự nhiễm khuẩn đường ruột.","Protein, lipid, glucid (chủ yếu inulase), mangan, photpho, sắt và vitamin A, B1, B2, C.",1,0.915107119,1.0,0.771325341
Tên khoa học của cây Bầu là gì?,"['#### 2 BẦU\nBầu, còn gọi là Bầu canh, Bầu nậm – Lagenaria siceraria (Molina) Standl., thuộc họ Bầu bí – Cucurbitaceae. Bầu là loại dây leo có tua cuốn phân nhánh, phủ bởi nhiều lông mềm, có lá hình tim rộng không xẻ thuỳ hay hơi xẻ thuỳ nông; hoa đơn tính, cùng gốc, to, màu trắng; quả tròn, dài, hình trụ có thể đến 1 mét (thứ hispida (Thunb.) Hara), hoặc thắt eo lại như bầu tượu (thứ microcarpa (Naud.) Hara), có lông, vỏ màu lục nhạt hay sẫm, hoặc có đốm trông giống như sao (bầu sao), khi già thì vỏ quả ngoài hoá gỗ (dùng để đựng rượu, dựng nước hoặc làm nhạc cụ như dàn bầu).\n\nCây bầu gốc ở châu Mỹ, ngày nay được trồng rộng rãi ở các vùng nhiệt đới và bán nhiệt đới trên thế giới. Ở nước ta, bầu được trồng khắp nơi làm rau ăn mùa hè. Quả bầu là bộ phận được sử dụng để luộc hoặc\n\nnấu canh... hay xào ăn. Bầu luộc chấm nước mắm tôm, mắm tép, hoặc nấu canh với tép, với cá. Người ta còn thái bầu ra thành từng miếng nhỏ phơi khô để ăn dần.\n\n![](![id: cay-rau-lam-thuoc_img_005](cay-rau-lam-thuoc_img_005.png))\nNgười ta đã phân tích được trong 100g quả tươi có 0,6g protein, 2,9g glucid calcium, 25mg phophor, 0,2mg sắt, và các vitamin : caroten 0,02mg, vitamin  $B_1$  0,02mg, vitamin  $B_2$  0,03mg, vitamin PP 0,40mg, vitamin C 12mg. Nhiệt lượng do 100g bầu cung cấp là 14 calo. Cũng có tài liệu cho biết trong 100g quả bầu tươi có (theo %) : Nước 89, Protein 0,5, Lipid 0,1, Cellulose 0,8, Dẫn xuất không protein 9,2 và khoáng toàn phần 0,4.\n\nNhiều bộ phận của cây bầu được sử dụng làm thuốc. Thịt quả bầu có vị ngọt, tính hàn, có tác dụng giải nhiệt, trừ độc, dùng chữa đái rắt, chứng phù nề (như chứng sưng ống chân và chứng đầy hơi, nếu ăn thì lâu khỏi). Còn chữa bệnh tiêu khát uống nhiều, đái tháo và máu nóng sinh mụn lở.\nLá bầu có vị ngọt, tính bình, có thể làm thức ăn chống đói. Tua cuốn và hoa bầu có tác dụng giải thải độc, nấu tắm cho trẻ em để phòng ngừa đậu sởi, lở ngứa. Hạt bầu dùng chữa lợi răng sưng đau, răng lung lay, tụt lợi chân răng lộ ra, dùng với Ngưu tất, mỗi vị 20g, nấu lấy nước ngậm và súc miệng, ngày 3–4 lần.\n\n![](![id: cay-rau-lam-thuoc_img_006](cay-rau-lam-thuoc_img_006.png))', '## ĐẬU BẮP\nĐậu bắp, Mướp tây, Bắp chà hay Bụp bắp - Abelmoschus esculentus (L.) Moench, thuộc họ Bông - Malvaceae. Cây thân thảo mọc đứng cao tới 2,5m, có nhiều lông. Lá hình tim hay hình chân vịt, mép có tăng lớn, ráp, có lông dài Hoa mọc ở nách lá, màu đỏ, trông giống hoa bông. Quả nang dài hay dựng đứng cỡ 3,5cm, có màu lục sáng, có mặt cắt hình thoi.\n\nĐậu bắp gốc ở Ấn đô, được trồng ở nhiều nơi trong nước ta, nhất là ở các tỉnh phía Nam để lấy quả xanh ăn như các loại đậu, dùng quả xào, luộc, làm nước chấm, nấu canh chua với cá, lươn, làm dậy mùi thịt, cá. Cũng có thể\n\n![](![id: cay-rau-lam-thuoc_img_041](cay-rau-lam-thuoc_img_041.png))\n\n\nnướng chín trong tro nóng hoặc ăn sống như dưa chuột. Quả non phơi khô, bảo quản để ăn dần. Có tác giả cho biết 62g Đậu bắp trong đó chứa 1,3g protein và 4,8g glucid sẽ cung cấp cho cơ thể 25 calo.\nNgười ta đã biết trong quả chứa 4-16% hydrat carbon gồm chủ yếu là tinh bột và đường, palmitin và stearin. Hạt chứa 15-26% chất dầu lỏng màu vàng xanh có mùi dễ chịu, dùng ăn được, có tính hoạt nhuận.\n\nQuả chứa chất nhầy khi tan ra làm cho thức ăn đặc và có vị chua mát. Lá non cũng dùng luộc hay xào ān.\n\nTất cả các bộ phận của cây đều dùng làm thuốc giảm đau và làm dịu trong các loại bệnh như lậu, bí tiểu tiện và bạch đới. Còn dùng làm thuốc nhuận tràng. Rễ và là thái mỏng phơi khô dùng làm thuốc chữa ho, viêm họng. Ngày dùng 12-16g hām hoặc sắc uống; còn dùng súc miệng.\n\nHạt khô chín nghiền ra dùng để uống thay cà phê hoặc nấu lên làm hồ giấy, làm chất dính trong kỹ thuật làm giấy.', '#### 3 BẦU ĐẤT\n\nBầu đất, còn gọi là Kim thất, Rau lúi, Rau bầu đất – Gynura procumbens (Lour.) Merr. = Gynura sarmentosa DC., thuộc họ Cúc – Asteraceae. Bầu đất mọc bò và hơi leo, cao đến 1m, mọng nước, phân nhiều cành. Lá dày, giòn, thuôn, xanh lợt ở mặt dưới, hơi tía ở mặt trên và xanh ở gân. Cụm hoa ở ngọn cây gồm nhiều đầu màu tía, các hoa trong đầu hoa hình ống, màu vàng. Quả bé mang một mào lông trắng ở đỉnh.\nBầu đất phân bố ở nhiều nước châu Á như Ấn độ, Indônêxia, Thái lan, Philippin và Việt nam. Bầu đất là loài rau mọc hoang nhưng cũng thường được trồng ở nhiều nơi làm rau ăn và làm thuốc. Người ta thường dùng lá và ngọn non nấu canh cua. Canh bầu đất được xem như là bổ, mát dùng cho trẻ em ăn chữa chứng đái dầm và ra mồ hôi trộm. Cũng dùng chữa đái són, đái buốt. Người ta cũng dùng bầu đất nấu canh\n\nlàm thức ăn chữa bệnh phụ nữ viêm bàng quang mạn tính, khí hư, bạch đới. Hoặc sắc nước ưống với bột Thổ tam thất và Ý dĩ sao, với liều bằng nhau, mỗi lần 10–15g, ngày uống 2 lần.\n\n![](![id: cay-rau-lam-thuoc_img_007](cay-rau-lam-thuoc_img_007.png))\n\nỞ Campuchia, thân và lá bầu đất, dùng phối hợp với những loài cây khác dùng để hạ nhiệt trong chứng sốt phát ban như các bệnh sởi, tính hồng nhiệt.\n\nỞ Malaixia, người ta cũng dùng lá ăn trộn với dầu, giấm và cũng dùng cây để trị lỵ. Còn ở Java (Inđônêxia), người ta dùng nó để trị bệnh đau thận.\nNgoài cây bầu đất, còn có nhiều loài khác cùng chi cũng được sử dụng làm rau ăn, thường dùng nấu canh, như cây Cải kim thất hay Rau lúi - Gynura barbaraefolia Gagnep, Cải giả - Gynura nitida DC. và cây Rau tàu bay sẽ nói ở sau.']",Tên khoa học của cây Bầu là Lagenaria siceraria (Molina) Standl.,Lagenaria siceraria (Molina) Standl.,1,0.895793414,0.5,0.614857
"Trong ẩm thực, bộ phận nào của Bầu đất thường dùng nấu canh?","['#### 2 BẦU\nBầu, còn gọi là Bầu canh, Bầu nậm – Lagenaria siceraria (Molina) Standl., thuộc họ Bầu bí – Cucurbitaceae. Bầu là loại dây leo có tua cuốn phân nhánh, phủ bởi nhiều lông mềm, có lá hình tim rộng không xẻ thuỳ hay hơi xẻ thuỳ nông; hoa đơn tính, cùng gốc, to, màu trắng; quả tròn, dài, hình trụ có thể đến 1 mét (thứ hispida (Thunb.) Hara), hoặc thắt eo lại như bầu tượu (thứ microcarpa (Naud.) Hara), có lông, vỏ màu lục nhạt hay sẫm, hoặc có đốm trông giống như sao (bầu sao), khi già thì vỏ quả ngoài hoá gỗ (dùng để đựng rượu, dựng nước hoặc làm nhạc cụ như dàn bầu).\n\nCây bầu gốc ở châu Mỹ, ngày nay được trồng rộng rãi ở các vùng nhiệt đới và bán nhiệt đới trên thế giới. Ở nước ta, bầu được trồng khắp nơi làm rau ăn mùa hè. Quả bầu là bộ phận được sử dụng để luộc hoặc\n\nnấu canh... hay xào ăn. Bầu luộc chấm nước mắm tôm, mắm tép, hoặc nấu canh với tép, với cá. Người ta còn thái bầu ra thành từng miếng nhỏ phơi khô để ăn dần.\n\n![](![id: cay-rau-lam-thuoc_img_005](cay-rau-lam-thuoc_img_005.png))\nNgười ta đã phân tích được trong 100g quả tươi có 0,6g protein, 2,9g glucid calcium, 25mg phophor, 0,2mg sắt, và các vitamin : caroten 0,02mg, vitamin  $B_1$  0,02mg, vitamin  $B_2$  0...', '#### 3 BẦU ĐẤT\n\nBầu đất, còn gọi là Kim thất, Rau lúi, Rau bầu đất – Gynura procumbens (Lour.) Merr. = Gynura sarmentosa DC., thuộc họ Cúc – Asteraceae. Bầu đất mọc bò và hơi leo, cao đến 1m, mọng nước, phân nhiều cành. Lá dày, giòn, thuôn, xanh lợt ở mặt dưới, hơi tía ở mặt trên và xanh ở gân. Cụm hoa ở ngọn cây gồm nhiều đầu màu tía, các hoa trong đầu hoa hình ống, màu vàng. Quả bé mang một mào lông trắng ở đỉnh.\nBầu đất phân bố ở nhiều nước châu Á như Ấn độ, Indônêxia, Thái lan, Philippin và Việt nam. Bầu đất là loài rau mọc hoang nhưng cũng thường được trồng ở nhiều nơi làm rau ăn và làm thuốc. Người ta thường dùng lá và ngọn non nấu canh cua. Canh bầu đất được xem như là bổ, mát dùng cho trẻ em ăn chữa chứng đái dầm và ra mồ hôi trộm. Cũng dùng chữa đái són, đái buốt. Người ta cũng dùng bầu đất nấu canh\n\nlàm thức ăn chữa bệnh phụ nữ viêm bàng quang mạn tính, khí hư, bạch đới. Hoặc sắc nước ưống với bột Thổ tam thất và Ý dĩ sao, với liều bằng nhau, mỗi lần 10–15g, ngày uống 2 lần.\n\n![](![id: cay-rau-lam-thuoc_img_007](cay-rau-lam-thuoc_img_007.png))\n\nỞ Campuchia, thân và lá bầu đất, dùng phối hợp với những loài cây khác dùng để hạ nhiệt trong chứng sốt phát ban như các bệnh sởi...', '#### 14 CẢI CANH\n\nCải canh hay Cải bẹ xanh thường gọi là Rau cải – Brassica juncea (L.) Czern. et Coss., thuộc họ Cải – Brassicaceae là loại rau thường được trồng phổ biến để làm rau ăn sống hoặc nấu canh với tép, tôm, cá lóc, thịt lợn nạc... hoặc dùng muối dưa (cũng như Rau cải củ hay lú bú) có thể muối xả hay muối nén nguyên cây.\n\n![](![id: cay-rau-lam-thuoc_img_019](cay-rau-lam-thuoc_img_019.png))\nDưa cải là món ăn rất thông dụng. Nó có thể chế biến ra thành những món ăn khác nhau như dùng ăn ngay chấm với nước thịt kho, cá kho, nước mắm, nấu canh với thịt, với cá, chưng cá, xắt nhuyễn chưng với trứng vịt, hay kho với lòng heo, nước tương, kho với thịt v.v... Dưa cải có thể muối ăn liền (chọn cây có ngồng, cắt khúc phơi héo rồi muối trong 1–2 ngày để ăn) hoặc muối dưa để lâu (phải để nguyên cây rồi phơi héo rồi muối vào khạp để ăn trong 2–3 tháng).\n\nHạt Cải canh hình cầu, màu đen nâu (gọi là Giới tử) dùng làm thuốc và ép dầu (tỷ lệ 20%) chế mù tạc làm gia vị và dùng trong công nghiệp.\nCải canh là loại rau lợi tiểu. Hạt Cải canh có vị cay, tính ấm, vào kinh phế, có tác dụng tiêu hoá đờm thấp, chữa ho hen, làm tan khí trệ, giảm đau, chữa kết hạch. Để chữa ho, hen, đờm suyễn ở ngườ...']","Trong ẩm thực, lá và ngọn non của Bầu đất thường được dùng để nấu canh cua. Canh bầu đất được xem như là bổ dưỡng và mát, dùng cho trẻ em ăn để chữa chứng đái dầm và ra mồ hôi trộm, cũng như để chữa đái són, đái buốt.",Lá và ngọn non.,0,0.312332068,1.0,0.81437719
Canh Bầu đất theo kinh nghiệm dân gian hỗ trợ trẻ em với chứng gì?,"['#### 3 BẦU ĐẤT\n\nBầu đất, còn gọi là Kim thất, Rau lúi, Rau bầu đất – Gynura procumbens (Lour.) Merr. = Gynura sarmentosa DC., thuộc họ Cúc – Asteraceae. Bầu đất mọc bò và hơi leo, cao đến 1m, mọng nước, phân nhiều cành. Lá dày, giòn, thuôn, xanh lợt ở mặt dưới, hơi tía ở mặt trên và xanh ở gân. Cụm hoa ở ngọn cây gồm nhiều đầu màu tía, các hoa trong đầu hoa hình ống, màu vàng. Quả bé mang một mào lông trắng ở đỉnh.\nBầu đất phân bố ở nhiều nước châu Á như Ấn độ, Indônêxia, Thái lan, Philippin và Việt nam. Bầu đất là loài rau mọc hoang nhưng cũng thường được trồng ở nhiều nơi làm rau ăn và làm thuốc. Người ta thường dùng lá và ngọn non nấu canh cua. Canh bầu đất được xem như là bổ, mát dùng cho trẻ em ăn chữa chứng đái dầm và ra mồ hôi trộm. Cũng dùng chữa đái són, đái buốt. Người ta cũng dùng bầu đất nấu canh\n\nlàm thức ăn chữa bệnh phụ nữ viêm bàng quang mạn tính, khí hư, bạch đới. Hoặc sắc nước ưống với bột Thổ tam thất và Ý dĩ sao, với liều bằng nhau, mỗi lần 10–15g, ngày uống 2 lần.\n\n![](![id: cay-rau-lam-thuoc_img_007](cay-rau-lam-thuoc_img_007.png))\n\nỞ Campuchia, thân và lá bầu đất, dùng phối hợp với những loài cây khác dùng để hạ nhiệt trong chứng sốt phát ban như các bệnh sởi...', '#### 2 BẦU\nBầu, còn gọi là Bầu canh, Bầu nậm – Lagenaria siceraria (Molina) Standl., thuộc họ Bầu bí – Cucurbitaceae. Bầu là loại dây leo có tua cuốn phân nhánh, phủ bởi nhiều lông mềm, có lá hình tim rộng không xẻ thuỳ hay hơi xẻ thuỳ nông; hoa đơn tính, cùng gốc, to, màu trắng; quả tròn, dài, hình trụ có thể đến 1 mét (thứ hispida (Thunb.) Hara), hoặc thắt eo lại như bầu tượu (thứ microcarpa (Naud.) Hara), có lông, vỏ màu lục nhạt hay sẫm, hoặc có đốm trông giống như sao (bầu sao), khi già thì vỏ quả ngoài hoá gỗ (dùng để đựng rượu, dựng nước hoặc làm nhạc cụ như dàn bầu).\n\nCây bầu gốc ở châu Mỹ, ngày nay được trồng rộng rãi ở các vùng nhiệt đới và bán nhiệt đới trên thế giới. Ở nước ta, bầu được trồng khắp nơi làm rau ăn mùa hè. Quả bầu là bộ phận được sử dụng để luộc hoặc\n\nnấu canh... hay xào ăn. Bầu luộc chấm nước mắm tôm, mắm tép, hoặc nấu canh với tép, với cá. Người ta còn thái bầu ra thành từng miếng nhỏ phơi khô để ăn dần.\n\n![](![id: cay-rau-lam-thuoc_img_005](cay-rau-lam-thuoc_img_005.png))\nNgười ta đã phân tích được trong 100g quả tươi có 0,6g protein, 2,9g glucid calcium, 25mg phophor, 0,2mg sắt, và các vitamin : caroten 0,02mg, vitamin  $B_1$  0,02mg, vitamin  $B_2$  0...', '## Page 159\n\n- Các tác nhân (yếu tố thuận lợi) :\n\n + Khóc, cười, bịt mũi ép trẻ ăn\n\n + Tranh nhau ăn\n\n + Hắt hơi\n\n + Vấp ngã...\n\n- Do trẻ nhỏ phản xạ đóng mở thanh môn chưa hoàn chỉnh\n\n- Bố mẹ cẩu thả trong việc ăn uống của trẻ\n\n- Do tập quán ăn uống, hay tắm nước suối, uống nước suối gây dị vật sống vào\nđường thở\n\n- Do liệt hầu họng...\n\n2. 2. Do thầy thuốc:\n\n- Nhổ răng gây rơi răng, mũi khoan răng rơi vào đường thở\n\n- Khi nhỏ thuốc kim tiêm rơi vào đường thở\n\n- Cho uống thuốc không đúng quy cách\n\n3. Biến chứng:\n\n-  Tử vong do ngạt thở cấp\n\n-  Viêm phế quản\n\n-  Phế quản phế viêm\n\n-  Xẹp phổi\n\n-  Áp xe phổi, tràn mủ màng phổi do áp xe vỡ vào màng phổi\n\n-  Tràn khí màng phổi, trung thất\n\n-  Giãn phế quản do dị vật bỏ quên lâu ngày\n\n\n\n</break>']","Theo kinh nghiệm dân gian, canh bầu đất hỗ trợ trẻ em với các chứng đái dầm và ra mồ hôi trộm. Canh này cũng được sử dụng để chữa chứng đái són và đái buốt.",Đái dầm và ra mồ hôi trộm.,1,0.638843158,1.0,0.602277714
Bèo sen còn được gọi bằng những tên nào?,"['#### 4 BÈO SEN\n\nBèo sen hay Bèo tây, Bèo Nhật bản, Lục bình – Eichhornia crassipes (Mart.) Solms, thuộc họ Bèo sen – Pontederiacae. Cây thân thảo, sống nhiều năm, nổi trên mặt nước hoặc bám nơi đất bùn, mang một chùm rễ dài và rậm ở phía dưới. Kích thước của cây thường thay đổi tuỳ theo môi trường sống có nhiều hay ít chất mùn. Lá mọc thành hình hoa thị,\n\ncó cuống phình lên thanh phao nổi, gân lá hình cung. Cụm hoa hình bông hay chuỳ ở ngọn, dài 15cm hay hơn. Hoa không đều, màu xanh nhạt hay tím. Các lá đài và cánh hoa cùng màu hàn liền với nhau ở gốc ; cánh hoa trên có một đốm vàng. Quả nang, nhưng ít khi gặp.\nBèo sen gốc ở Brazil, được mang vào làm cảnh ở nước ta từ năm 1905 và đã nhanh chóng lan ra khắp nơi, thường gặp ở những chỗ có nước bị tù hãm hoặc nơi nước ngọt chảy chậm như ao, hồ, đầm, mương máng, ven sông. Ở nước ta, bèo sen sống quanh năm, sinh sản chủ yếu bằng con đường vô tính. Từ nách lá đâm ra những thân bò dài, và mỗi đỉnh thân bồ cho một cây mới, về sau tách ra thành một cá thể độc lập.\n\nỞ nước ta, người ta thường dùng bèo sen làm phân xanh bón ruộng, làm chất độn để ủ phân chuồng và đặc biệt là làm thức ăn xanh hoặc nấu chín với cám và bột ngô cho lợn ăn. Bèo se...', '## (140) SEN CẠN\nSen cạn – Tropaeolum majus L., thuộc họ Sen cạn – Tropaeolaceae. Cây thảo mọc leo hay không, sống hằng năm. Lá giống lá Sen, có cuống dài đính ở giữa phiến tròn, mép nguyên, mặt trên màu lục nhạt, mặt dưới mốc mốc. Hoa ở nách lá, màu vàng, vàng cam hay màu đỏ. 5 lá đài nhọn, lá đài sau mang một cái cựa hình nón, cong ở đầu, 5 cánh hoa không bằng nhau. Nhị 8, rời nhau. Bầu 3 ô, mỗi ô chứa 1 noãn. Quả lớn, cỡ 1cm, có 3 mảnh vỏ, có vách dày và xốp, chứa 3 hạt.\n\nSen cạn gốc ở rừng sâu châu Mỹ, phân bố từ Chi-lê cho tới tận Mêhicô. Người ta mô tả nó đầu tiên vào thế kỷ 16, với tên gọi là Hoa màu máu của Pêru. Còn gọi là Cải soong Mỹ hay Cải soong Mêhicô. Có người còn gọi nó là Hoa tình yêu do tính chất kích dục của nó.\nLá Sen cạn có thể dùng ăn sống như rau xà lách. Thường dùng nấu súp với khoai tây, có vị cay dễ chịu. Hoa dùng để trang điểm các đĩa rau sống. Các nụ hoa dùng ngâm giấm làm gia vị, có vị giống rau cải soong. Phân tích 100g lá Sen cạn tươi, người ta được 265mg vitamin C. Các tế bào lá chứa myrosin và một glycozid chứa sulfur gọi là glucotropaeolozid, đồng đẳng dưới của gluconasturtozid có trong cải soong khi thuỷ phân cho tinh dầu isothiocyanat benzyl. Ngư...', '#### 13 CẢI BẸ TRẮNG\nCải bẹ trắng, Cải thìa, Cải rổ tàu, Cải bắc thảo hay Cải bắp dài – Brassica chinensis L., thuộc họ Cải–Brassicaceae. Cây thảo sống 1–2 năm, cao 25–70cm hay hơn, lá chụm ở đất, nhiều, màu lục tươi, dài 20–30cm, mép nhăn, nhiều gân, cuống dẹp, rộng 2–7cm, trắng; hoa màu vàng tươi; quả cải có mỏ ngắn.\n\nCải bẹ trắng gốc ở Châu Á (vùng Nam Á) đã được gây trồng ở nhiều nước, hiện có nhiều giống trồng, có một số giống có lá ít sít nhau, một số giống khác có lõi bắp dài và chắc. Ở nước ta, Cải bẹ được trồng khắp nơi; ở Đà lạt cũng trồng nhiều giống lá xoăn, lỗi bắp chắc (Cải thảo).\nCác lá ngoài màu lục nhạt, hơi cứng dùng nấu canh ăn như Bối xôi và các loại rau Cải khác; còn phần lõi bắp cuộn lại ở phía trong, trắng và mềm, có thể dùng ăn sống, trộn dầu, giấm như xà lách, dùng nấu canh, nấu lẩu hoặc xào ăn đều ngọt cả. Cải bẹ cũng có thể dùng để chế biến các món ăn có thể để dành lâu dài, ví dụ như muối dưa. Loại cải thảo có thể dùng xắt khúc nhỏ đem tẩm xì dầu để phơi cất ăn dần, dùng nấu canh thịt, hấp cá, ăn hủ tiếu, ăn thịt bò viên. Cuống cải thảo có thể xắt miếng, lẫn với Cà rốt đem\n\n![](![id: cay-rau-lam-thuoc_img_018](cay-rau-lam-thuoc_img_018.png))\n\nmuối (thêm ...']","Bèo sen còn được gọi bằng những tên như Bèo tây, Bèo Nhật bản, và Lục bình. Trong tiếng Anh, nó được gọi là Eichhornia crassipes (Mart.) Solms.","Bèo tây, Bèo Nhật Bản, Lục bình.",1,0.813787709,1.0,0.799863133
Lá Bèo sen dùng đắp ngoài thường để làm gì?,"['#### 4 BÈO SEN\n\nBèo sen hay Bèo tây, Bèo Nhật bản, Lục bình – Eichhornia crassipes (Mart.) Solms, thuộc họ Bèo sen – Pontederiacae. Cây thân thảo, sống nhiều năm, nổi trên mặt nước hoặc bám nơi đất bùn, mang một chùm rễ dài và rậm ở phía dưới. Kích thước của cây thường thay đổi tuỳ theo môi trường sống có nhiều hay ít chất mùn. Lá mọc thành hình hoa thị,\n\ncó cuống phình lên thanh phao nổi, gân lá hình cung. Cụm hoa hình bông hay chuỳ ở ngọn, dài 15cm hay hơn. Hoa không đều, màu xanh nhạt hay tím. Các lá đài và cánh hoa cùng màu hàn liền với nhau ở gốc ; cánh hoa trên có một đốm vàng. Quả nang, nhưng ít khi gặp.\nBèo sen gốc ở Brazil, được mang vào làm cảnh ở nước ta từ năm 1905 và đã nhanh chóng lan ra khắp nơi, thường gặp ở những chỗ có nước bị tù hãm hoặc nơi nước ngọt chảy chậm như ao, hồ, đầm, mương máng, ven sông. Ở nước ta, bèo sen sống quanh năm, sinh sản chủ yếu bằng con đường vô tính. Từ nách lá đâm ra những thân bò dài, và mỗi đỉnh thân bồ cho một cây mới, về sau tách ra thành một cá thể độc lập.\n\nỞ nước ta, người ta thường dùng bèo sen làm phân xanh bón ruộng, làm chất độn để ủ phân chuồng và đặc biệt là làm thức ăn xanh hoặc nấu chín với cám và bột ngô cho lợn ăn. Bèo se...', '## (140) SEN CẠN\nSen cạn – Tropaeolum majus L., thuộc họ Sen cạn – Tropaeolaceae. Cây thảo mọc leo hay không, sống hằng năm. Lá giống lá Sen, có cuống dài đính ở giữa phiến tròn, mép nguyên, mặt trên màu lục nhạt, mặt dưới mốc mốc. Hoa ở nách lá, màu vàng, vàng cam hay màu đỏ. 5 lá đài nhọn, lá đài sau mang một cái cựa hình nón, cong ở đầu, 5 cánh hoa không bằng nhau. Nhị 8, rời nhau. Bầu 3 ô, mỗi ô chứa 1 noãn. Quả lớn, cỡ 1cm, có 3 mảnh vỏ, có vách dày và xốp, chứa 3 hạt.\n\nSen cạn gốc ở rừng sâu châu Mỹ, phân bố từ Chi-lê cho tới tận Mêhicô. Người ta mô tả nó đầu tiên vào thế kỷ 16, với tên gọi là Hoa màu máu của Pêru. Còn gọi là Cải soong Mỹ hay Cải soong Mêhicô. Có người còn gọi nó là Hoa tình yêu do tính chất kích dục của nó.\nLá Sen cạn có thể dùng ăn sống như rau xà lách. Thường dùng nấu súp với khoai tây, có vị cay dễ chịu. Hoa dùng để trang điểm các đĩa rau sống. Các nụ hoa dùng ngâm giấm làm gia vị, có vị giống rau cải soong. Phân tích 100g lá Sen cạn tươi, người ta được 265mg vitamin C. Các tế bào lá chứa myrosin và một glycozid chứa sulfur gọi là glucotropaeolozid, đồng đẳng dưới của gluconasturtozid có trong cải soong khi thuỷ phân cho tinh dầu isothiocyanat benzyl. Ngư...', '#### 91) NGÓ SEN\n\nNgó sen là phần thân rễ hình trụ của cây Sen -Nelumbo nucifera (L.) Gaertn., thuộc họ Sen - Nelumbonaceae.\n\nNó chứa nhiều chất bột (70%), đường đạm, đạm, vitamin C, A, B<sub>1</sub>, PP và một số chất khác như asparagin, arginin, trigonellin, tytosin... và một số ít tanin. Ngó sen được sử dụng làm thực phẩm như một loại rau và làm được liệu.\n\nVề thực phẩm, ngó sen được xem là một loại món ăn sang trọng. Người ta thường dùng ngó sen để nấu canh, xào, làm dưa, làm mứt, nấu chè hoặc chế biến thành ngó\n\n![](![id: cay-rau-lam-thuoc_img_098](cay-rau-lam-thuoc_img_098.png))\n\nsen lát khô, bột ngó sen dùng cho các loại bánh (bánh phồng tôm) và làm bột dinh dưỡng.\n\nThông thường, ta hay dùng ngó sen để làm rau ăn như rau cải :\n- Dưa sen: Dùng ngó sen đã rửa sạch đem ngâm trong nước vo gạo pha muối để ủ chua khoảng 3 ngày, làm dưa ăn sống.\n- Gỏi sen: Dùng dưa ngó sen cắt khúc ngắn để vào đĩa, sau đó cho gia vị như giấm, đường, bột ngọt, nước mắm vào trộn đều. Sau đó, cho thêm Hành tây cắt lát, rau thơm và thịt ba rọi luộc chín, tôm nướng, mỡ nước, lạc (đậu phộng) rang làm thành món gỏi ăn với nước mắm, chanh, ớt.\n- Ngó sen xào: Ngó sen đem về rửa sạch, xắt khúc, đem xào với t...']","Lá Bèo sen thường được dùng đắp ngoài để chữa các vấn đề liên quan đến sưng tấy hoặc viêm đau. Cụ thể, phần phình của cuống lá bèo sen được giã nát và thêm muối (khoảng 5–8g muối trong 100g bèo) để đắp lên các vùng bị sưng tấy hoặc viêm đau như sưng bắp chuối ở bẹn, tiêm bị áp xe, chín mé, sưng nách, viêm tinh hoàn, viêm khớp ngón tay, viêm hạch bạch huyết, v.v...","Đắp chữa sưng tấy, viêm đau (áp xe, chín mé, sưng nách, viêm tinh hoàn, viêm khớp...).",0,0.578321,1.0,0.692987989
